firstCoder,secondCoder,doi,authors,pubYear,excluded,exclusionReason,articleType,citesReplication,citationClassificationOriginal,citationClassificationAgreed,counterArguments,evidenceCounter,evidenceVerbatim,methodsCounter,methodsVerbatim,expertiseCounter,expertiseVerbatim,UT,case,timePeriod
SC,MN,10.1108/LODJ-06-2015-0120,"Wray, Christopher",2017,FALSE,NA,No empirical data,FALSE,favourable,favourable,NA,NA,NA,NA,NA,NA,NA,WOS:000402935600004,strack,post
MN,OA,10.1080/13669877.2015.1057206,"Raue, Martina; Streicher, Bernhard; Lermer, Eva; Frey, Dieter",2017,FALSE,NA,Empirical data - multiple study types are reported,FALSE,favourable,favourable,NA,NA,NA,NA,NA,NA,NA,WOS:000401656100002,strack,post
MN,OA,10.1080/02103702.2017.1306942,"Pozo, Juan-Ignacio",2017,FALSE,NA,No empirical data,FALSE,favourable,favourable,NA,NA,NA,NA,NA,NA,NA,WOS:000400943600002,strack,post
MN,OA,10.1108/JOSM-11-2015-0372,"Otterbring, Tobias",2017,FALSE,NA,Empirical data - field study,FALSE,favourable,favourable,NA,NA,NA,NA,NA,NA,NA,WOS:000401069200005,strack,post
MN,OA,10.1080/17470218.2016.1238950,"Lewis, Michael B.; Dunn, Emily",2017,FALSE,NA,Empirical data - laboratory study,FALSE,favourable,favourable,NA,NA,NA,NA,NA,NA,NA,WOS:000399503200012,strack,post
MN,OA,10.1080/17405629.2016.1201474,"Famelart, Nawelle; Guidetti, Michele",2017,FALSE,NA,Empirical data - laboratory study,FALSE,favourable,favourable,NA,NA,NA,NA,NA,NA,NA,WOS:000395747500005,strack,post
MN,OA,10.1016/j.eujim.2017.01.011,"Shim, Minjung; Johnson, R. Burke; Gasson, Susan; Goodill, Sherry; Jermyn, Richard; Bradt, Joke",2017,FALSE,NA,Empirical data - multiple study types are reported,FALSE,favourable,favourable,NA,NA,NA,NA,NA,NA,NA,WOS:000396403400004,strack,post
MN,OA,10.1027/1618-3169/a000351,"Jospe, Karine; Floeel, Agnes; Lavidor, Michal",2017,FALSE,NA,Empirical data - laboratory study,FALSE,favourable,favourable,NA,NA,NA,NA,NA,NA,NA,WOS:000394549600007,strack,post
MN,OA,10.1080/02699931.2015.1073692,"Topolinski, Sascha; Boecker, Lea; Erle, Thorsten M.; Bakhtiari, Giti; Pecher, Diane",2017,FALSE,NA,Empirical data - laboratory study,FALSE,favourable,favourable,NA,NA,NA,NA,NA,NA,NA,WOS:000387259500002,strack,post
MN,OA,10.5465/amj.2013.1135,"Gabriel, Allison S.; Diefendorff, James M.",2015,FALSE,NA,Empirical data - laboratory study,FALSE,favourable,favourable,NA,NA,NA,NA,NA,NA,NA,WOS:000367502400010,strack,pre
MN,OA,10.1037/xge0000125,"Papesh, Megan H.",2015,FALSE,NA,Empirical data - laboratory study,FALSE,favourable,favourable,NA,NA,NA,NA,NA,NA,NA,WOS:000365615200004,strack,pre
MN,OA,10.1037/a0038783,"Sinaceur, Marwan; Kopelman, Shirli; Vasiljevic, Dimitri; Haag, Christophe",2015,FALSE,NA,Empirical data - laboratory study,FALSE,favourable,favourable,NA,NA,NA,NA,NA,NA,NA,WOS:000364588900011,strack,pre
MN,OA,10.1111/desc.12278,"Eigsti, Inge-Marie; Rosset, Delphine; Cozzari, Ghislaine Col; da Fonseca, David; Deruelle, Christine",2015,FALSE,NA,Empirical data - laboratory study,FALSE,favourable,favourable,NA,NA,NA,NA,NA,NA,NA,WOS:000362911400017,strack,pre
MN,OA,10.1097/PRS.0000000000001733,"Magid, Michelle; Keeling, Brett H.; Reichenberg, Jason S.",2015,FALSE,NA,Data synthesis - meta-analysis,FALSE,favourable,favourable,NA,NA,NA,NA,NA,NA,NA,WOS:000362519300001,strack,pre
MN,OA,10.1002/wcs.1370,"Price, Tom F.; Harmon-Jones, Eddie",2015,FALSE,NA,No empirical data,FALSE,favourable,favourable,NA,NA,NA,NA,NA,NA,NA,WOS:000362731900001,strack,pre
MN,OA,10.1080/10400419.2015.1087258,"Kim, JongHan",2015,FALSE,NA,Empirical data - laboratory study,FALSE,favourable,favourable,NA,NA,NA,NA,NA,NA,NA,WOS:000364557100005,strack,pre
MN,OA,10.1093/scan/nsv009,"Sel, Alejandra; Calvo-Merino, Beatriz; Tuettenberg, Simone; Forster, Bettina",2015,FALSE,NA,Empirical data - laboratory study,FALSE,favourable,favourable,NA,NA,NA,NA,NA,NA,NA,WOS:000365543400003,strack,pre
MN,OA,10.1016/j.neubiorev.2015.09.004,"van der Weiden, Anouk; Prikken, Mere; van Haren, Neeltje E. M.",2015,FALSE,NA,No empirical data,FALSE,favourable,unclassifiable,NA,NA,NA,NA,NA,NA,NA,WOS:000364271200016,strack,pre
MN,OA,10.1177/1754073915590622,"Butler, Emily A.",2015,FALSE,NA,No empirical data,FALSE,favourable,favourable,NA,NA,NA,NA,NA,NA,NA,WOS:000362491800007,strack,pre
MN,OA,10.1016/j.cortex.2015.07.024,"Caruana, Fausto; Avanzini, Pietro; Gozzo, Francesca; Francione, Stefano; Cardinale, Francesco; Rizzolatti, Giacomo",2015,FALSE,NA,Empirical data - laboratory study,FALSE,favourable,favourable,NA,NA,NA,NA,NA,NA,NA,WOS:000362131300028,strack,pre
MN,OA,10.1037/emo0000078,"Gawronski, Bertram; Mitchell, Derek G. V.; Balas, Robert",2015,FALSE,NA,Empirical data - laboratory study,FALSE,favourable,favourable,NA,NA,NA,NA,NA,NA,NA,WOS:000361906200004,strack,pre
MN,OA,10.3390/brainsci5030357,"Lobmaier, Janek S.; Fischer, Martin H.",2015,FALSE,NA,Empirical data - laboratory study,FALSE,favourable,favourable,NA,NA,NA,NA,NA,NA,NA,WOS:000363127500005,strack,pre
MN,OA,10.1016/j.cortex.2015.06.025,"Korb, Sebastian; Malsert, Jennifer; Rochas, Vincent; Rihs, Tonia A.; Rieger, Sebastian W.; Schwab, Samir; Niedenthal, Paula M.; Grandjean, Didier",2015,FALSE,NA,Empirical data - laboratory study,FALSE,favourable,favourable,NA,NA,NA,NA,NA,NA,NA,WOS:000360949300009,strack,pre
MN,OA,10.1037/bul0000020,"Peters, Kim; Kashima, Yoshihisa",2015,FALSE,NA,No empirical data,FALSE,favourable,favourable,NA,NA,NA,NA,NA,NA,NA,WOS:000359785500002,strack,pre
MN,OA,10.1002/wcs.1357,"Uithol, Sebo; Gallese, Vittorio",2015,FALSE,NA,No empirical data,FALSE,favourable,favourable,NA,NA,NA,NA,NA,NA,NA,WOS:000359856400005,strack,pre
MN,OA,10.3389/fnhum.2015.00464,"Gerger, Gernot; Leder, Helmut",2015,FALSE,NA,Empirical data - laboratory study,FALSE,favourable,favourable,NA,NA,NA,NA,NA,NA,NA,WOS:000360271800001,strack,pre
MN,OA,10.1080/02699931.2014.968096,"Laham, Simon M.; Kashima, Yoshihisa; Dix, Jennifer; Wheeler, Melissa",2015,TRUE,Cited in references but not in text,Data synthesis - meta-analysis,NA,NA,NA,NA,NA,NA,NA,NA,NA,NA,WOS:000356598900008,strack,pre
MN,OA,10.1093/asj/sjv032,"Dayan, Steven H.",2015,FALSE,NA,No empirical data,FALSE,favourable,favourable,NA,NA,NA,NA,NA,NA,NA,WOS:000360572500028,strack,pre
MN,OA,10.1177/0959354315585661,"Pouw, Wim T. J. L.; de Jong, Huib Looren",2015,FALSE,NA,No empirical data,FALSE,favourable,favourable,NA,NA,NA,NA,NA,NA,NA,WOS:000359151900001,strack,pre
MN,OA,10.1080/10810730.2015.1018570,"Hendriks, Hanneke; van den Putte, Bas; de Bruijn, Gert-Jan",2015,FALSE,NA,Empirical data - survey,FALSE,favourable,favourable,NA,NA,NA,NA,NA,NA,NA,WOS:000357092700015,strack,pre
MN,OA,10.3389/fpsyg.2015.00940,"Koerner, Anita; Topolinski, Sascha; Strack, Fritz",2015,FALSE,NA,No empirical data,FALSE,favourable,favourable,NA,NA,NA,NA,NA,NA,NA,WOS:000357611100001,strack,pre
MN,OA,10.1016/j.actpsy.2015.05.003,"Zhu, Nan; Cai, Yong-hua; Sun, Fa-wei; Yang-yang, Yi-fan",2015,FALSE,NA,Empirical data - laboratory study,FALSE,favourable,favourable,NA,NA,NA,NA,NA,NA,NA,WOS:000358270800006,strack,pre
MN,OA,10.1037/a0038543,"Cuddy, Amy J. C.; Wilmuth, Caroline A.; Yap, Andy J.; Carney, Dana R.",2015,FALSE,NA,Empirical data - laboratory study,FALSE,favourable,favourable,NA,NA,NA,NA,NA,NA,NA,WOS:000357814500021,strack,pre
MN,OA,10.1016/j.concog.2015.03.017,"Yoshimi, Jeff; Vinson, David W.",2015,FALSE,NA,No empirical data,FALSE,favourable,favourable,NA,NA,NA,NA,NA,NA,NA,WOS:000355054000014,strack,pre
MN,OA,10.1371/journal.pone.0127619,"Gross, Jorg; Woelbert, Eva; Strobel, Martin",2015,FALSE,NA,Empirical data - laboratory study,FALSE,favourable,favourable,NA,NA,NA,NA,NA,NA,NA,WOS:000355979500045,strack,pre
MN,OA,10.3167/proj.2015.090102,"Zacks, Jeffrey M.",2015,FALSE,NA,No empirical data,FALSE,favourable,favourable,NA,NA,NA,NA,NA,NA,NA,WOS:000378636500002,strack,pre
MN,OA,10.3389/fpsyg.2015.00650,"Arminjon, Mathieu; Preissmann, Delphine; Chmetz, Florian; Duraku, Andrea; Ansermet, Francois; Magistretti, Pierre J.",2015,FALSE,NA,Empirical data - laboratory study,FALSE,favourable,favourable,NA,NA,NA,NA,NA,NA,NA,WOS:000355489700001,strack,pre
MN,OA,10.1016/j.biopsycho.2015.03.005,"Dan-Glauser, Elise S.; Gross, James J.",2015,FALSE,NA,Empirical data - laboratory study,FALSE,favourable,favourable,NA,NA,NA,NA,NA,NA,NA,WOS:000353996100001,strack,pre
MN,OA,10.1037/a0038648,"Quoidbach, Jordi; Mikolajczak, Moira; Gross, James J.",2015,FALSE,NA,No empirical data,FALSE,favourable,favourable,NA,NA,NA,NA,NA,NA,NA,WOS:000353725000006,strack,pre
MN,OA,10.1080/07370008.2015.1038539,"Tsang, Jessica M.; Blair, Kristen P.; Bofferding, Laura; Schwartz, Daniel L.",2015,FALSE,NA,Empirical data - laboratory study,FALSE,favourable,favourable,NA,NA,NA,NA,NA,NA,NA,WOS:000355094900003,strack,pre
MN,OA,10.3389/fnhum.2015.00178,"Payne, Peter; Crane-Godreau, Mardi A.",2015,FALSE,NA,No empirical data,FALSE,favourable,favourable,NA,NA,NA,NA,NA,NA,NA,WOS:000352654100001,strack,pre
MN,OA,10.1016/j.actpsy.2014.08.007,"Filik, Ruth; Hunter, Christian Mark; Leuthold, Hartmut",2015,FALSE,NA,Empirical data - laboratory study,FALSE,equivocal,unclassifiable,NA,NA,NA,NA,NA,NA,NA,WOS:000351799500014,strack,pre
MN,OA,10.1177/0956797614561044,"Aragon, Oriana R.; Clark, Margaret S.; Dyer, Rebecca L.; Bargh, John A.",2015,FALSE,NA,Empirical data - laboratory study,FALSE,favourable,favourable,NA,NA,NA,NA,NA,NA,NA,WOS:000351443700001,strack,pre
MN,OA,10.1007/s11133-014-9295-7,"Pagis, Michal",2015,FALSE,NA,Empirical data - field study,FALSE,favourable,favourable,NA,NA,NA,NA,NA,NA,NA,WOS:000351397000006,strack,pre
MN,OA,10.1016/j.cognition.2014.11.007,"Slepian, Michael L.",2015,FALSE,NA,Empirical data - laboratory study,FALSE,favourable,favourable,NA,NA,NA,NA,NA,NA,NA,WOS:000349882600034,strack,pre
MN,OA,10.1093/lpr/mgu018,"Edmond, Gary; Tangen, Jason M.; Searston, Rachel A.; Dror, Itiel E.",2015,FALSE,NA,No empirical data,FALSE,favourable,favourable,NA,NA,NA,NA,NA,NA,NA,WOS:000370850800001,strack,pre
MN,OA,10.1016/j.jbtep.2014.09.004,"Michalak, Johannes; Rohde, Katharina; Troje, Nikolaus F.",2015,FALSE,NA,Empirical data - laboratory study,FALSE,favourable,favourable,NA,NA,NA,NA,NA,NA,NA,WOS:000346625200018,strack,pre
MN,OA,10.1007/s12559-013-9225-0,"Hiyoshi-Taniguchi, K.; Kawasaki, M.; Yokota, T.; Bakardjian, H.; Fukuyama, H.; Cichocki, A.; Vialatte, F. B.",2015,FALSE,NA,Empirical data - laboratory study,FALSE,unclassifiable,unclassifiable,NA,NA,NA,NA,NA,NA,NA,WOS:000349525500003,strack,pre
MN,OA,10.1080/1047840X.2014.940781,"Gross, James J.",2015,FALSE,NA,No empirical data,FALSE,favourable,favourable,NA,NA,NA,NA,NA,NA,NA,WOS:000350648700001,strack,pre
MN,OA,10.1080/10413200.2014.953231,"Moesch, Karin; Kentta, Goran; Backstrom, Martin; Mattsson, C. Mikael",2015,FALSE,NA,Empirical data - field study,FALSE,favourable,favourable,NA,NA,NA,NA,NA,NA,NA,WOS:000346830900007,strack,pre
MN,OA,10.1007/978-94-017-9963-8_1,"Christov-Moore, Leonardo; Iacoboni, Marco",2015,FALSE,NA,No empirical data,FALSE,unclassifiable,favourable,NA,NA,NA,NA,NA,NA,NA,WOS:000376962500002,strack,pre
MN,OA,10.1007/978-3-319-25232-2_7,"Mohammad, Yasser; Nishida, Toyoaki",2015,FALSE,NA,No empirical data,FALSE,favourable,favourable,NA,NA,NA,NA,NA,NA,NA,WOS:000370531400008,strack,pre
MN,OA,NA,"Cuccio, Valentina",2015,FALSE,NA,No empirical data,FALSE,favourable,favourable,NA,NA,NA,NA,NA,NA,NA,WOS:000370772200007,strack,pre
MN,OA,10.5127/jep.039613,"Meeten, Frances; Ivak, Peter; Dash, Suzanne R.; Knowles, Sam; Duka, Theodora; Scott, Ryan; Kaiser, Jakob; Davey, Graham C. L.",2015,FALSE,NA,Empirical data - laboratory study,FALSE,favourable,favourable,NA,NA,NA,NA,NA,NA,NA,WOS:000370293200005,strack,pre
MN,OA,10.1111/cura.12094,"Overhill, Heidi",2015,FALSE,NA,No empirical data,FALSE,favourable,unclassifiable,NA,NA,NA,NA,NA,NA,NA,WOS:000363651200002,strack,pre
MN,OA,10.1016/bs.aesp.2015.01.002,"van Harreveld, Frenk; Nohlen, Hannah U.; Schneider, Iris K.",2015,FALSE,NA,No empirical data,FALSE,favourable,favourable,NA,NA,NA,NA,NA,NA,NA,WOS:000363328500005,strack,pre
MN,OA,10.1080/19416520.2015.1033148,"Menges, Jochen I.; Kilduff, Martin",2015,FALSE,NA,No empirical data,FALSE,favourable,favourable,NA,NA,NA,NA,NA,NA,NA,WOS:000362012300014,strack,pre
MN,OA,NA,"Topolinski, Sascha",2015,FALSE,NA,No empirical data,FALSE,unclassifiable,favourable,NA,NA,NA,NA,NA,NA,NA,WOS:000351551000009,strack,pre
MN,OA,10.1080/1463922X.2015.1067934,"Jeon, Myounghoon",2015,FALSE,NA,No empirical data,FALSE,favourable,favourable,NA,NA,NA,NA,NA,NA,NA,WOS:000212946600001,strack,pre
OA,MN,10.1037/neu0000580,"Osborne-Crowley, Katherine; Wilson, Emily; De Blasio, Frances; Wearne, Travis; Rushby, Jacqueline; McDonald, Skye",2019,FALSE,NA,Empirical data - laboratory study,TRUE,equivocal,equivocal,FALSE,NA,NA,NA,NA,NA,NA,WOS:000494295100011,strack,post
OA,MN,10.1162/jocn_a_01445,"Kuehne, Maria; Siwy, Isabelle; Zaehle, Tino; Heinze, Hans-Jochen; Lobmaier, Janek S.",2019,FALSE,NA,Empirical data - laboratory study,TRUE,favourable,favourable,FALSE,NA,NA,NA,NA,NA,NA,WOS:000489746800003,strack,post
OA,MN,10.1007/s11229-019-02347-x,"Doulatova, Maria",2019,FALSE,NA,No empirical data,TRUE,unfavourable,unfavourable,FALSE,NA,NA,NA,NA,NA,NA,WOS:000492642700003,strack,post
OA,MN,10.3758/s13423-019-01674-x,"Iani, Francesco",2019,FALSE,NA,No empirical data,TRUE,unfavourable,unfavourable,FALSE,NA,NA,NA,NA,NA,NA,WOS:000492578500002,strack,post
OA,MN,10.3389/fpsyg.2019.02297,"Cross, Marie P.; Gheorma, Liana; Pressman, Sarah D.",2019,FALSE,NA,Empirical data - laboratory study,TRUE,equivocal,equivocal,FALSE,NA,NA,NA,NA,NA,NA,WOS:000497505100001,strack,post
OA,MN,10.1037/met0000216,"Rouder, Jeffrey N.; Haaf, Julia M.; Davis-Stober, Clintin P.; Hilgard, Joseph",2019,FALSE,NA,Data synthesis - meta-analysis,TRUE,unfavourable,unfavourable,FALSE,NA,NA,NA,NA,NA,NA,WOS:000488839300007,strack,post
OA,MN,10.1037/emo0000476,"Palagi, Elisabetta; Norscia, Ivan; Pressi, Serena; Cordoni, Giada",2019,FALSE,NA,Empirical data - field study,TRUE,unfavourable,unfavourable,FALSE,NA,NA,NA,NA,NA,NA,WOS:000468755500011,strack,post
OA,MN,10.1080/02699931.2018.1456406,"Rummer, Ralf; Schweppe, Judith",2019,FALSE,NA,Empirical data - laboratory study,TRUE,favourable,favourable,FALSE,NA,NA,NA,NA,NA,NA,WOS:000465125200002,strack,post
OA,MN,10.1111/mila.12215,"Arango-Munoz, Santiago",2019,FALSE,NA,No empirical data,TRUE,equivocal,equivocal,FALSE,NA,NA,NA,NA,NA,NA,WOS:000465428400006,strack,post
OA,MN,10.1037/emo0000532,"Marsh, Abigail A.; Rhoads, Shawn A.; Ryan, Rebecca M.",2019,FALSE,NA,Empirical data - field study,TRUE,favourable,favourable,TRUE,NA,NA,TRUE,"(1) In a response, Strack (2016) praised the researchers’ goals but highlighted several features of the RRR that deviated from the original paradigm and may have influenced the observed effect. (2) A second concern was the recruitment of participants from psychology subject pools. (3) A third concern was the use of Far Side cartoons from the 1980s that may be less relevant to contemporary students and which resulted in exclusion of some participants who did not understand the cartoons.",NA,NA,WOS:000500013700016,strack,post
OA,MN,10.1038/s41598-019-48275-1,"Bulnes, L. C.; Marien, P.; Vandekerckhove, M.; Cleeremans, A.",2019,FALSE,NA,Empirical data - laboratory study,TRUE,favourable,favourable,TRUE,NA,NA,TRUE,"Yet, this failure –or the presence or absence of the effects- seemed attributable to a single variation in the design, as an even more recent study reported results supporting both, the famous Strack et al. study as well as the OSF replication report11. The crucial element being the presence or absence of a recording camera during the experiment.",NA,NA,WOS:000480517100014,strack,post
OA,MN,10.1037/bul0000194,"Coles, Nicholas A.; Larsen, Jeff T.; Lench, Heather C.",2019,FALSE,NA,Data synthesis - meta-analysis,TRUE,equivocal,equivocal,TRUE,NA,NA,TRUE,"In a commentary on Wagenmakers et al.’s (2016) failure-to-replicate, Strack (2016) suggested that one reason the results of the original experiment may not have replicated is that cameras were directed at participants in the replication studies. Strack reasoned that awareness of video recording may induce a subjective self-focus that disrupts the flow of experience and suppresses emotional responses.",NA,NA,WOS:000468382400003,strack,post
OA,MN,10.1038/s41598-019-55029-6,"Fernandes, Alexandre C.; Garcia-Marques, Teresa",2019,FALSE,NA,Empirical data - laboratory study,FALSE,favourable,favourable,NA,NA,NA,NA,NA,NA,NA,WOS:000501891500001,strack,post
OA,MN,10.1016/j.plrev.2019.10.008,"Schoeller, F.; Haar, A. J. H.; Jain, A.; Maes, P.",2019,FALSE,NA,Empirical data - laboratory study,FALSE,favourable,favourable,NA,NA,NA,NA,NA,NA,NA,WOS:000506723100022,strack,post
OA,MN,10.1111/zygo.12553,"Beharrell, William H.",2019,FALSE,NA,No empirical data,FALSE,favourable,favourable,NA,NA,NA,NA,NA,NA,NA,WOS:000496165000010,strack,post
OA,MN,10.1177/1747021819867856,"Virhia, Jasmine; Kotz, Sonja A.; Adank, Patti",2019,FALSE,NA,Empirical data - laboratory study,FALSE,equivocal,favourable,NA,NA,NA,NA,NA,NA,NA,WOS:000494437800010,strack,post
OA,MN,10.3389/fpsyg.2019.02458,"Derya, Dilara; Kang, June; Kwon, Young; Wallraven, Christian",2019,FALSE,NA,Empirical data - laboratory study,FALSE,equivocal,favourable,NA,NA,NA,NA,NA,NA,NA,WOS:000535786900001,strack,post
OA,MN,10.1016/j.destud.2019.10.007,"Heylighen, Ann; Dong, Andy",2019,FALSE,NA,No empirical data,FALSE,favourable,favourable,NA,NA,NA,NA,NA,NA,NA,WOS:000504782100007,strack,post
OA,MN,10.3389/fpsyg.2019.02439,"Huggins, Charlotte F.; Cameron, Isobel M.; Williams, Justin H. G.",2019,FALSE,NA,Empirical data - laboratory study,FALSE,favourable,favourable,NA,NA,NA,NA,NA,NA,NA,WOS:000497542400001,strack,post
OA,MN,10.1177/1754073919868762,"Coles, Nicholas A.; Larsen, Jeff T.; Kuribayashi, Joyce; Kuelz, Ashley",2019,FALSE,NA,Data synthesis - meta-analysis,FALSE,favourable,favourable,NA,NA,NA,NA,NA,NA,NA,WOS:000487911000003,strack,post
OA,MN,10.3389/fpsyg.2019.01389,"Melzer, Ayelet; Shafir, Tal; Tsachor, Rochelle Palnick",2019,FALSE,NA,Empirical data - laboratory study,FALSE,favourable,favourable,NA,NA,NA,NA,NA,NA,NA,WOS:000473589800001,strack,post
OA,MN,NA,"Isern-Mas, Carme; Gomila, Antoni",2019,FALSE,NA,No empirical data,FALSE,favourable,favourable,NA,NA,NA,NA,NA,NA,NA,WOS:000497712900005,strack,post
OA,MN,10.1111/jaac.12659,"Sizer, Laura",2019,FALSE,NA,No empirical data,FALSE,favourable,favourable,NA,NA,NA,NA,NA,NA,NA,WOS:000478740700002,strack,post
OA,MN,10.1177/0031512519834389,"Marmeleira, Jose; Santos, Graca Duarte",2019,FALSE,NA,No empirical data,FALSE,favourable,favourable,NA,NA,NA,NA,NA,NA,NA,WOS:000473508600004,strack,post
OA,MN,10.1177/1745691618808523,"Wrobel, Monika; Imbir, Kamil K.",2019,FALSE,NA,No empirical data,FALSE,favourable,favourable,NA,NA,NA,NA,NA,NA,NA,WOS:000468290800008,strack,post
OA,MN,10.1037/gpr0000156,"Sedikides, Constantine; Lenton, Alison P.; Slabu, Letitia; Thomaes, Sander",2019,FALSE,NA,No empirical data,FALSE,unclassifiable,favourable,NA,NA,NA,NA,NA,NA,NA,WOS:000469342200006,strack,post
OA,MN,NA,"Wyer, Robert S., Jr.",2019,FALSE,NA,No empirical data,FALSE,favourable,favourable,NA,NA,NA,NA,NA,NA,NA,WOS:000509553400007,strack,post
OA,MN,10.1007/978-3-319-91716-0_26,"Kindermann, Harald; Auinger, Franz",2018,FALSE,NA,No empirical data,FALSE,favourable,favourable,NA,NA,NA,NA,NA,NA,NA,WOS:000553513800026,strack,post
OA,MN,10.1016/j.chb.2017.02.019,"Pena, Jorge; Chen, Meng",2017,FALSE,NA,Empirical data - laboratory study,FALSE,favourable,favourable,NA,NA,NA,NA,NA,NA,NA,WOS:000399511000044,strack,post
OA,MN,NA,"Ravenscroft, Ian",2017,FALSE,NA,No empirical data,FALSE,favourable,favourable,NA,NA,NA,NA,NA,NA,NA,WOS:000449485000014,strack,post
OA,MN,NA,"Goldstein, Thalia R.",2015,FALSE,NA,No empirical data,FALSE,favourable,favourable,NA,NA,NA,NA,NA,NA,NA,WOS:000376609300017,strack,pre
RT,SC,10.1177/0098628318762900,"Chopik, William J.; Bremner, Ryan H.; Defever, Andrew M.; Keller, Victor N.",2018,FALSE,NA,Empirical data - field study,TRUE,unclassifiable,unclassifiable,FALSE,NA,NA,NA,NA,NA,NA,WOS:000429950000007,carter,post
RT,SC,10.1111/bjso.12197,"Chan, Eugene Y.",2017,FALSE,NA,Empirical data - survey,TRUE,equivocal,equivocal,FALSE,NA,NA,NA,NA,NA,NA,WOS:000416841700011,carter,post
RT,SC,10.1037/xge0000307,"Shanks, David R.",2017,FALSE,NA,Empirical data - commentary including analysis,TRUE,unfavourable,unfavourable,FALSE,NA,NA,NA,NA,NA,NA,WOS:000406614300012,carter,post
RT,SC,10.1111/tops.12265,"Gobet, Fernand",2017,FALSE,NA,No empirical data,TRUE,unfavourable,unfavourable,FALSE,NA,NA,NA,NA,NA,NA,WOS:000400362700015,carter,post
RT,SC,10.1016/j.copsyc.2016.04.010,"Ottati, Victor; Wilson, Chase; Lambert, Alan",2016,FALSE,NA,No empirical data,TRUE,favourable,favourable,FALSE,NA,NA,NA,NA,NA,NA,WOS:000390915800002,carter,post
RT,SC,10.1016/j.shpsa.2016.10.002,"Romero, Felipe",2016,FALSE,NA,No empirical data,TRUE,unfavourable,unfavourable,FALSE,NA,NA,NA,NA,NA,NA,WOS:000390737000007,carter,post
RT,SC,10.1111/pops.12305,"Kalmoe, Nathan P.; Gross, Kimberly",2016,FALSE,NA,Empirical data - multiple study types are reported,TRUE,favourable,favourable,FALSE,NA,NA,NA,NA,NA,NA,WOS:000387770400008,carter,post
RT,SC,10.1027/2151-2604/a000250,"Kuehberger, Anton; Scherndl, Thomas; Ludwig, Bastian; Simon, Dominique M.",2016,FALSE,NA,Data synthesis - meta-analysis,TRUE,unfavourable,unfavourable,FALSE,NA,NA,NA,NA,NA,NA,WOS:000391262500002,carter,post
RT,SC,10.1177/0956797614559730,"Brandt, Mark J.; Evans, Anthony M.; Crawford, Jarret T.",2015,FALSE,NA,Empirical data - survey,TRUE,unclassifiable,unclassifiable,FALSE,NA,NA,NA,NA,NA,NA,WOS:000349622000008,carter,post
RT,SC,10.3389/fpsyg.2018.01657,"Cheng, Yongtian; Li, Johnson Ching-Hong; Liu, Xiyao",2018,FALSE,NA,No empirical data,TRUE,unclassifiable,unclassifiable,TRUE,NA,NA,TRUE,"For example, in replication studies of Currency Priming (Caruso et al., 2013) and Flag Priming (Carter et al., 2011; Study 2) in the Many Labs project (Klein et al., 2014) researchers have found that most of the mean or median ESs of there replication studies are at or even below the lower bound of the 95% ESCIs in the original studies. These results are highly incompatible with the current model of common practice in which original studies and replication studies always share an identical distribution prior to data collection. To better interpret these results, researchers should conduct more research in order to find out whether this pattern of result is due to the criterion (i.e., CPro and CPer) they used for evaluating reproducibility, or whether there is a real replication crisis in these replication studies.",NA,NA,WOS:000444352400001,carter,post
RT,SC,10.1016/j.jesp.2015.09.017,"Stroebe, Wolfgang",2016,FALSE,NA,No empirical data,TRUE,favourable,favourable,TRUE,NA,NA,TRUE,"All four projects relied on exact replications, often using the material used in the original studies. However, as I argued earlier (Stroebe & Strack, 2014), even if an experimental manipulation exactly replicates the one used in the original study, it may not reflect the same theoretical variable. The failed replication of the flag study provides an example for such a discrepancy. As Ferguson et al. (2014) argued, “national flags, ex hypothesis, activate knowledge related to one's nation that is shaped by the prevailing political atmosphere, which is hardly inert. The original experiment was run in 2009 – shortly after the first African-American was sworn in as president of the US – whereas the ManyLabs research was run four years later, in the 5th year of his presidency. …. Although many effects should remain stable over time (e.g., numerical anchoring effects), stimuli that represent time-sensitive knowledge and events (e.g., political and national symbols) should be expected to change over time, making “direct” replication difficult” (p. 301). Klein, Ratliff, Vianello, et al. (2014b) agreed with these arguments. In their concluding comment, they stated: “Direct replication does not guarantee that the same effect was tested”. Although direct replications attempt to duplicate the conditions and procedure of the original experiment, “attempting to do so does not guarantee success. Every replication is different in innumerable ways from the original” (Klein et al., 2014b, p. 307).",NA,NA,WOS:000381166900014,carter,post
RT,SC,10.3389/fpsyg.2015.00584,"Hesselmann, Guido; Moors, Pieter",2015,FALSE,NA,No empirical data,TRUE,equivocal,equivocal,TRUE,NA,NA,TRUE,"In his review of the literature, Hassin also cites his own work on priming which suggests that both invisible (Hassin et al., 2007) and visible yet subtle (Carter et al., 2011) exposure to national flags significantly changed political attitudes and voting intentions up to 8 months later. Only after publication of the YIC principle, a large-scale, preregistered “many labs” replication project did not replicate the finding that visible yet subtle exposure to the American flag increased conservatism among US participants (Klein et al., 2014). While replication should become a standard tool in psychological science to confirm the accuracy of empirical findings, clarify the conditions under which an effect can be observed, and estimate the true effect size (Open Science Collaboration, 2012; Simons, 2014), failures to replicate often leave relevant questions unanswered, in particular questions about the specificity of the underlying theories (Klein, 2014)1. It is important to note that Hassin and colleagues supported the replication attempt and acknowledged the failure to replicate the flag priming effect, but also raised the issue of whether it was a “conceptual” rather than “direct” replication, and they addressed the importance of identifying potential moderators of the original phenomenon and of understanding the theory behind the effects (Ferguson et al., 2014).",NA,NA,WOS:000355339000003,carter,post
