firstCoder,secondCoder,doi,authors,pubYear,excluded,exclusionReason,articleType,citesReplication,citationClassificationOriginal,citationClassificationAgreed,counterArguments,evidenceCounter,evidenceVerbatim,methodsCounter,methodsVerbatim,expertiseCounter,expertiseVerbatim,UT,case,timePeriod
DS,TH,10.1007/s00426-014-0558-4,"Sellaro, Roberta; Hommel, Bernhard; Manai, Meriem; Colzato, Lorenza S.",2015,FALSE,NA,Empirical data - laboratory study,FALSE,favourable,favourable,NA,NA,NA,NA,NA,NA,NA,WOS:000349768400011,baumeister,pre
DS,TH,10.1523/JNEUROSCI.4567-14.2015,"Bernardi, Giulio; Siclari, Francesca; Yu, Xiaoqian; Zennig, Corinna; Bellesi, Michele; Ricciardi, Emiliano; Cirelli, Chiara; Ghilardi, Maria Felice; Pietrini, Pietro; Tononi, Giulio",2015,FALSE,NA,Empirical data - laboratory study,FALSE,equivocal,equivocal,NA,NA,NA,NA,NA,NA,NA,WOS:000352202300002,baumeister,pre
DS,TH,10.1002/bdm.1830,"Pang, Bo; Otto, A. Ross; Worthy, Darrell A.",2015,FALSE,NA,Empirical data - laboratory study,FALSE,favourable,favourable,NA,NA,NA,NA,NA,NA,NA,WOS:000351535700008,baumeister,pre
DS,TH,10.1016/j.beproc.2014.09.030,"Miller, Holly C.; Pattison, Kristina F.; Laude, Jennifer R.; Zentall, Thomas R.",2015,FALSE,NA,Empirical data - laboratory study,FALSE,favourable,favourable,NA,NA,NA,NA,NA,NA,NA,WOS:000349198500004,baumeister,pre
DS,TH,10.1037/a0038082,"Trougakos, John P.; Beal, Daniel J.; Cheng, Bonnie Hayden; Hideg, Ivona; Zweig, David",2015,FALSE,NA,Empirical data - laboratory study,FALSE,favourable,favourable,NA,NA,NA,NA,NA,NA,NA,WOS:000347729700015,baumeister,pre
DS,TH,10.1108/S1479-355520150000013003,"Dixon, Aurora J.; Chang, Chu-Hsiang (Daisy); Johnson, Russell E.",2015,FALSE,NA,No empirical data,FALSE,favourable,favourable,NA,NA,NA,NA,NA,NA,NA,WOS:000361324700004,baumeister,pre
DS,TH,10.1016/j.jvb.2015.03.005,"Rivkin, W.; Diestel, S.; Schmidt, K. -H.",2015,FALSE,NA,Empirical data - laboratory study,FALSE,favourable,equivocal,NA,NA,NA,NA,NA,NA,NA,WOS:000354594300018,baumeister,pre
DS,TH,10.1037/gdn0000033,"Bradley, Bret H.; Anderson, Heather J.; Baur, John E.; Klotz, Anthony C.",2015,FALSE,NA,No empirical data,FALSE,favourable,favourable,NA,NA,NA,NA,NA,NA,NA,WOS:000369411100003,baumeister,pre
DS,TH,10.1080/01973533.2014.996225,"Osgood, Jeffrey M.; Muraven, Mark",2015,FALSE,NA,Empirical data - laboratory study,FALSE,favourable,equivocal,NA,NA,NA,NA,NA,NA,NA,WOS:000349454600007,baumeister,pre
DS,TH,10.1093/scan/nsu027,"Parvaz, Muhammad A.; Moeller, Scott J.; Goldstein, Rita Z.; Proudfit, Greg H.",2015,FALSE,NA,Empirical data - laboratory study,FALSE,favourable,favourable,NA,NA,NA,NA,NA,NA,NA,WOS:000350108600012,baumeister,pre
DS,TH,10.1037/apl0000018,"Lin, Szu-Han (Joanna); Johnson, Russell E.",2015,FALSE,NA,Empirical data - laboratory study,FALSE,favourable,favourable,NA,NA,NA,NA,NA,NA,NA,WOS:000361042000005,baumeister,pre
DS,TH,10.1002/job.1953,"Park, Youngah; Sprung, Justin M.",2015,FALSE,NA,Empirical data - laboratory study,FALSE,favourable,favourable,NA,NA,NA,NA,NA,NA,NA,WOS:000348840600008,baumeister,pre
DS,TH,10.1016/j.leaqua.2015.02.005,"Collins, Michael D.; Jackson, Chris J.",2015,FALSE,NA,Empirical data - laboratory study,FALSE,favourable,favourable,NA,NA,NA,NA,NA,NA,NA,WOS:000356841500007,baumeister,pre
DS,TH,10.1002/ejsp.2120,"Chow, Jason T.; Hui, Chin Ming; Lau, Shun",2015,FALSE,NA,Empirical data - laboratory study,FALSE,favourable,favourable,NA,NA,NA,NA,NA,NA,NA,WOS:000364309700008,baumeister,pre
DS,TH,10.1017/iop.2015.93,"Eatough, Erin M.",2015,FALSE,NA,No empirical data,FALSE,favourable,favourable,NA,NA,NA,NA,NA,NA,NA,WOS:000368343800012,baumeister,pre
DS,TH,10.1002/cjas.1308,"Walsh, Darlene; Mantonakis, Antonia; Joordens, Steve",2015,FALSE,NA,Empirical data - laboratory study,FALSE,favourable,favourable,NA,NA,NA,NA,NA,NA,NA,WOS:000351520800006,baumeister,pre
DS,TH,10.1108/S1479-355520150000013002,"Koopmann, Jaclyn; Wang, Mo; Liu, Yihao; Song, Yifan",2015,FALSE,NA,No empirical data,FALSE,favourable,favourable,NA,NA,NA,NA,NA,NA,NA,WOS:000361324700003,baumeister,pre
DS,TH,10.1177/0959354314561487,"Horstkotter, Dorothee",2015,FALSE,NA,No empirical data,FALSE,favourable,favourable,NA,NA,NA,NA,NA,NA,NA,WOS:000349289100002,baumeister,pre
DS,TH,10.3389/fpsyg.2015.01207,"Englert, Chris; Persaud, Brittany N.; Oudejans, Raoul R. D.; Bertrams, Alex",2015,FALSE,NA,Empirical data - laboratory study,FALSE,equivocal,equivocal,NA,NA,NA,NA,NA,NA,NA,WOS:000359991000001,baumeister,pre
DS,TH,10.1016/j.appet.2014.10.025,"Chatzisarantis, Nikos L. D.; Hagger, Martin S.",2015,FALSE,NA,Empirical data - laboratory study,FALSE,favourable,favourable,NA,NA,NA,NA,NA,NA,NA,WOS:000347267000042,baumeister,pre
DS,TH,10.1002/smi.2639,"Hagger, Martin S.",2015,FALSE,NA,Empirical data - laboratory study,FALSE,favourable,equivocal,NA,NA,NA,NA,NA,NA,NA,WOS:000353651800001,baumeister,pre
DS,TH,10.1007/s10869-014-9392-3,"Shao, Bo; Wang, Lu; Cheng, David; Doucet, Lorna",2015,FALSE,NA,Empirical data - laboratory study,FALSE,favourable,favourable,NA,NA,NA,NA,NA,NA,NA,WOS:000365760400008,baumeister,pre
DS,TH,10.1111/spc3.12160,"Gillebaart, Marleen; de Ridder, Denise T. D.",2015,FALSE,NA,No empirical data,FALSE,unfavourable,unfavourable,NA,NA,NA,NA,NA,NA,NA,WOS:000214691000003,baumeister,pre
DS,TH,10.7352/IJSP2015.46.137,"Englert, Chris; Wolff, Wanja",2015,FALSE,NA,Empirical data - laboratory study,FALSE,favourable,favourable,NA,NA,NA,NA,NA,NA,NA,WOS:000356319200003,baumeister,pre
DS,TH,10.1002/job.2019,"Humphrey, Ronald H.; Ashforth, Blake E.; Diefendorff, James M.",2015,FALSE,NA,No empirical data,FALSE,equivocal,favourable,NA,NA,NA,NA,NA,NA,NA,WOS:000359071000002,baumeister,pre
DS,TH,10.1123/jsep.2014-0219,"Englert, Chris; Zwemmer, Kris; Bertrams, Alex; Oudejans, Raoul R. D.",2015,FALSE,NA,Empirical data - laboratory study,FALSE,favourable,favourable,NA,NA,NA,NA,NA,NA,NA,WOS:000355571600002,baumeister,pre
DS,TH,10.1016/j.copsyc.2015.01.013,"Weiss, Nicole H.; Sullivan, Tami P.; Tull, Matthew T.",2015,FALSE,NA,No empirical data,FALSE,favourable,favourable,NA,NA,NA,NA,NA,NA,NA,WOS:000364778800006,baumeister,pre
DS,TH,10.1017/S0954579414001321,"Sasaki, Joni Y.; Mojaverian, Taraneh; Kim, Heejung S.",2015,FALSE,NA,Empirical data - laboratory study,FALSE,equivocal,equivocal,NA,NA,NA,NA,NA,NA,NA,WOS:000354106300008,baumeister,pre
DS,TH,10.1002/smj.2221,"Laureiro-Martinez, Daniella; Brusoni, Stefano; Canessa, Nicola; Zollo, Maurizio",2015,FALSE,NA,Empirical data - laboratory study,FALSE,favourable,favourable,NA,NA,NA,NA,NA,NA,NA,WOS:000348506100001,baumeister,pre
DS,TH,NA,"Truscott, J",2015,FALSE,NA,No empirical data,FALSE,favourable,favourable,NA,NA,NA,NA,NA,NA,NA,WOS:000364179500010,baumeister,pre
DS,TH,10.1037/a0038339,"Holroyd, Clay B.; McClure, Samuel M.",2015,FALSE,NA,Empirical data - laboratory study,FALSE,favourable,favourable,NA,NA,NA,NA,NA,NA,NA,WOS:000347230300003,baumeister,pre
DS,TH,10.1037/a0033955,"Watkins, Laura E.; DiLillo, David; Hoffman, Lesa; Templin, Jonathan",2015,FALSE,NA,Empirical data - laboratory study,FALSE,favourable,favourable,NA,NA,NA,NA,NA,NA,NA,WOS:000346915900005,baumeister,pre
DS,TH,10.1037/a0036871,"Christoforou, Paraskevi S.; Ashforth, Blake E.",2015,FALSE,NA,Empirical data - laboratory study,FALSE,favourable,equivocal,NA,NA,NA,NA,NA,NA,NA,WOS:000347729700017,baumeister,pre
DS,TH,10.1016/j.acclit.2015.10.001,"Hurley, Patrick J.",2015,FALSE,NA,No empirical data,FALSE,favourable,favourable,NA,NA,NA,NA,NA,NA,NA,WOS:000367346700003,baumeister,pre
DS,TH,10.1016/j.jesp.2015.04.004,"Mazar, Nina; Hawkins, Scott A.",2015,FALSE,NA,Empirical data - laboratory study,FALSE,favourable,favourable,NA,NA,NA,NA,NA,NA,NA,WOS:000355497400014,baumeister,pre
DS,TH,10.1037/a0038542,"Dahm, Patricia C.; Glomb, Theresa M.; Manchester, Colleen Flaherty; Leroy, Sophie",2015,FALSE,NA,Empirical data - laboratory study,FALSE,favourable,favourable,NA,NA,NA,NA,NA,NA,NA,WOS:000353903300010,baumeister,pre
DS,TH,10.1016/j.drugalcdep.2015.07.679,"Weiss, Nicole H.; Tull, Matthew T.; Sullivan, Tami P.; Dixon-Gordon, Katherine L.; Gratz, Kim L.",2015,FALSE,NA,Empirical data - laboratory study,FALSE,favourable,favourable,NA,NA,NA,NA,NA,NA,NA,WOS:000362307000021,baumeister,pre
DS,TH,10.1037/pspp0000026,"Galla, Brian M.; Duckworth, Angela L.",2015,FALSE,NA,Empirical data - laboratory study,FALSE,favourable,favourable,NA,NA,NA,NA,NA,NA,NA,WOS:000360444400010,baumeister,pre
DS,TH,NA,"Waller, BN",2015,FALSE,NA,No empirical data,FALSE,favourable,favourable,NA,NA,NA,NA,NA,NA,NA,WOS:000358486000015,baumeister,pre
DS,TH,10.1111/sjop.12173,"Lange, Florian; Eggert, Frank",2015,FALSE,NA,Empirical data - laboratory study,FALSE,favourable,favourable,NA,NA,NA,NA,NA,NA,NA,WOS:000351217500001,baumeister,pre
DS,TH,10.1016/j.foodqual.2015.06.004,"Salmon, Stefanie J.; De Vet, Emely; Adriaanse, Marieke A.; Fennis, Bob M.; Veltkamp, Martijn; De Ridder, Denise T. D.",2015,FALSE,NA,Empirical data - laboratory study,FALSE,equivocal,equivocal,NA,NA,NA,NA,NA,NA,NA,WOS:000357836800013,baumeister,pre
DS,TH,10.3389/fpsyg.2015.01485,"Martinez-Inigo, David; Mercado, Francisco; Totterdell, Peter",2015,FALSE,NA,Empirical data - laboratory study,FALSE,favourable,favourable,NA,NA,NA,NA,NA,NA,NA,WOS:000363020400001,baumeister,pre
DS,TH,10.3389/fpsyg.2015.01193,"Petrillo, Francesca; Micucci, Antonia; Gori, Emanuele; Truppa, Valentina; Ariely, Dan; Addessi, Elsa",2015,FALSE,NA,Empirical data - laboratory study,FALSE,favourable,favourable,NA,NA,NA,NA,NA,NA,NA,WOS:000359940100002,baumeister,pre
DS,TH,10.1016/j.jshs.2014.09.002,"Audiffren, Michel; Andre, Nathalie",2015,FALSE,NA,No empirical data,FALSE,favourable,favourable,NA,NA,NA,NA,NA,NA,NA,WOS:000355267900005,baumeister,pre
DS,TH,10.1080/00224545.2014.977762,"Roberts, Megan E.; Gibbons, Frederick X.; Gerrard, Meg; Klein, William M. P.",2015,FALSE,NA,Empirical data - laboratory study,FALSE,unclassifiable,unclassifiable,NA,NA,NA,NA,NA,NA,NA,WOS:000349328100005,baumeister,pre
DS,TH,10.1007/s12160-014-9678-8,"Hagger, Martin S.",2015,FALSE,NA,No empirical data,FALSE,favourable,equivocal,NA,NA,NA,NA,NA,NA,NA,WOS:000354206300003,baumeister,pre
DS,TH,10.1287/mnsc.2014.2053,"Liu, Peggy J.; Haws, Kelly L.; Lamberton, Cait; Campbell, Troy H.; Fitzsimons, Gavan J.",2015,FALSE,NA,Empirical data - field study,FALSE,favourable,favourable,NA,NA,NA,NA,NA,NA,NA,WOS:000348073900013,baumeister,pre
DS,TH,10.1016/j.dr.2015.07.003,"Carey, Susan; Zaitchik, Deborah; Bascandziev, Igor",2015,FALSE,NA,No empirical data,FALSE,favourable,favourable,NA,NA,NA,NA,NA,NA,NA,WOS:000366782200003,baumeister,pre
DS,TH,10.1177/0001839214553655,"Christian, Michael S.; Eisenkraft, Noah; Kapadia, Chaitali",2015,FALSE,NA,Empirical data - laboratory study,FALSE,favourable,favourable,NA,NA,NA,NA,NA,NA,NA,WOS:000354860500006,baumeister,pre
DS,TH,10.1016/j.jesp.2014.11.006,"Egan, Patrick M.; Clarkson, Joshua J.; Hirt, Edward R.",2015,FALSE,NA,Empirical data - laboratory study,FALSE,favourable,favourable,NA,NA,NA,NA,NA,NA,NA,WOS:000348557500010,baumeister,pre
DS,TH,10.1007/s11031-014-9467-5,"Geisler, Fay C. M.; Schroeder-Abe, Michela",2015,FALSE,NA,Empirical data - laboratory study,FALSE,favourable,favourable,NA,NA,NA,NA,NA,NA,NA,WOS:000358266500009,baumeister,pre
DS,TH,10.1080/00224545.2014.972310,"Chow, Jason T.; Lau, Shun",2015,FALSE,NA,Empirical data - laboratory study,FALSE,favourable,favourable,NA,NA,NA,NA,NA,NA,NA,WOS:000346281600005,baumeister,pre
DS,TH,10.1509/jmr.13.0014,"Jin, Liyin; Xu, Qian; Zhang, Ying",2015,FALSE,NA,Empirical data - laboratory study,FALSE,favourable,favourable,NA,NA,NA,NA,NA,NA,NA,WOS:000368255900004,baumeister,pre
DS,TH,10.1016/j.eatbeh.2014.10.011,"Friese, Malte; Engeler, Michele; Florack, Arnd",2015,FALSE,NA,Empirical data - laboratory study,FALSE,equivocal,equivocal,NA,NA,NA,NA,NA,NA,NA,WOS:000346386500002,baumeister,pre
DS,TH,10.1037/emo0000013,"Franchow, Emilie I.; Suchy, Yana",2015,FALSE,NA,Empirical data - laboratory study,FALSE,favourable,favourable,NA,NA,NA,NA,NA,NA,NA,WOS:000349612400009,baumeister,pre
DS,TH,10.1037/xge0000065,"Tuk, Mirjam A.; Zhang, Kuangjie; Sweldens, Steven",2015,FALSE,NA,Empirical data - laboratory study,FALSE,unfavourable,unfavourable,NA,NA,NA,NA,NA,NA,NA,WOS:000355841000013,baumeister,pre
DS,TH,10.1016/j.joep.2014.12.003,"Dolan, Paul; Galizzi, Matteo M.",2015,FALSE,NA,No empirical data,FALSE,favourable,favourable,NA,NA,NA,NA,NA,NA,NA,WOS:000352249100001,baumeister,pre
DS,TH,10.1177/1745691614556681,"Thomson, David R.; Besner, Derek; Smilek, Daniel",2015,FALSE,NA,No empirical data,FALSE,favourable,favourable,NA,NA,NA,NA,NA,NA,NA,WOS:000348054400006,baumeister,pre
DS,TH,10.1037/a0038698,"Owens, Bradley P.; Wallace, Angela S.; Waldman, David A.",2015,FALSE,NA,Empirical data - laboratory study,FALSE,favourable,favourable,NA,NA,NA,NA,NA,NA,NA,WOS:000357814500013,baumeister,pre
DS,TH,NA,"Houdek, Petr; Koblovsky, Petr; St'astny, Daniel; Vranka, Marek",2015,FALSE,NA,No empirical data,FALSE,favourable,favourable,NA,NA,NA,NA,NA,NA,NA,WOS:000377394000010,baumeister,pre
DS,TH,10.1177/1087054712452915,"Manos, Michael J.; Caserta, Donald A.; Short, Elizabeth J.; Raleigh, Kristina L.; Giuliano, Kimberly C.; Pucci, Nicole C.; Frazier, Thomas W.",2015,FALSE,NA,Empirical data - laboratory study,FALSE,favourable,favourable,NA,NA,NA,NA,NA,NA,NA,WOS:000356429800003,baumeister,pre
DS,TH,10.1037/a0038067,"Dai, Hengchen; Milkman, Katherine L.; Hofmann, David A.; Staats, Bradley R.",2015,FALSE,NA,Empirical data - laboratory study,FALSE,favourable,favourable,NA,NA,NA,NA,NA,NA,NA,WOS:000353903300014,baumeister,pre
DS,TH,10.1891/0886-6708.VV-D-13-00174,"Simmen-Janevska, Keti; Forstmeier, Simon; Krammer, Sandy; Maercker, Andreas",2015,FALSE,NA,Empirical data - laboratory study,FALSE,favourable,favourable,NA,NA,NA,NA,NA,NA,NA,WOS:000366833600009,baumeister,pre
DS,TH,10.1177/0146167215591961,"Van Berkel, Laura; Crandall, Christian S.; Eidelman, Scott; Blanchar, John C.",2015,FALSE,NA,Empirical data - laboratory study,FALSE,equivocal,favourable,NA,NA,NA,NA,NA,NA,NA,WOS:000358876900004,baumeister,pre
DS,TH,10.1080/01973533.2015.1049348,"Bernecker, Katharina; Job, Veronika",2015,FALSE,NA,Empirical data - laboratory study,FALSE,favourable,favourable,NA,NA,NA,NA,NA,NA,NA,WOS:000356280000004,baumeister,pre
DS,TH,10.1016/j.addbeh.2014.09.011,"Baumeister, Roy F.; Vonasch, Andrew J.",2015,FALSE,NA,No empirical data,FALSE,favourable,favourable,NA,NA,NA,NA,NA,NA,NA,WOS:000351645100002,baumeister,pre
DS,TH,10.1037/pspp0000014,"Job, Veronika; Walton, Gregory M.; Bernecker, Katharina; Dweck, Carol S.",2015,FALSE,NA,Empirical data - laboratory study,FALSE,favourable,equivocal,NA,NA,NA,NA,NA,NA,NA,WOS:000352321900008,baumeister,pre
DS,TH,10.1038/s41598-017-07786-5,"Brevers, D.; He, Q.; Keller, B.; Noel, X.; Bechara, A.",2017,FALSE,NA,Empirical data - laboratory study,FALSE,favourable,favourable,NA,NA,NA,NA,NA,NA,NA,WOS:000407080100024,baumeister,post
DS,TH,10.1111/peps.12219,"Zhou, Le; Wang, Mo; Chang, Chu-Hsiang; Liu, Songqi; Zhan, Yujie; Shi, Junqi",2017,FALSE,NA,Empirical data - laboratory study,FALSE,favourable,favourable,NA,NA,NA,NA,NA,NA,NA,WOS:000414335800005,baumeister,post
DS,TH,10.1080/17437199.2016.1266275,"De Ridder, Denise; Gillebaart, Marleen",2017,FALSE,NA,No empirical data,TRUE,equivocal,favourable,FALSE,NA,NA,NA,NA,NA,NA,WOS:000395124000006,baumeister,post
DS,TH,10.1002/job.2109,"Kim, Sooyeol; Park, YoungAh; Niu, Qikun",2017,FALSE,NA,Empirical data - laboratory study,FALSE,favourable,favourable,NA,NA,NA,NA,NA,NA,NA,WOS:000392430000002,baumeister,post
DS,TH,10.1287/orsc.2017.1129,"Ramarajan, Lakshmi; Berger, Ida E.; Greenspan, Itay",2017,FALSE,NA,Empirical data - field study,FALSE,favourable,favourable,NA,NA,NA,NA,NA,NA,NA,WOS:000403752700007,baumeister,post
DS,TH,10.1016/j.appet.2017.08.029,"Cote, Marilou; Gagnon-Girouard, Marie-Pierre; Sabourin, Stephane; Begin, Catherine",2018,FALSE,NA,Empirical data - laboratory study,FALSE,favourable,favourable,NA,NA,NA,NA,NA,NA,NA,WOS:000416616400014,baumeister,post
DS,TH,"10.1016/j,appet.2016.12.018","Weathers, Danny; Siemens, Jennifer Christie; Kopp, Steven W.",2017,FALSE,NA,Empirical data - laboratory study,FALSE,favourable,favourable,NA,NA,NA,NA,NA,NA,NA,WOS:000394476200004,baumeister,post
DS,TH,10.1016/j.obhdp.2017.01.004,"Basu, Shankha; Savani, Krishna",2017,FALSE,NA,Empirical data - laboratory study,FALSE,unfavourable,unfavourable,NA,NA,NA,NA,NA,NA,NA,WOS:000396961200006,baumeister,post
DS,TH,10.3389/fpsyg.2017.00190,"Gillebaart, Marleen; Adriaanse, Marieke A.",2017,FALSE,NA,Empirical data - laboratory study,FALSE,favourable,favourable,NA,NA,NA,NA,NA,NA,NA,WOS:000393818000001,baumeister,post
DS,TH,10.1080/01426397.2017.1316365,"Jenkin, Rebecca; Frampton, Ian; White, Mathew P.; Pahl, Sabine",2018,FALSE,NA,Empirical data - field study,FALSE,favourable,favourable,NA,NA,NA,NA,NA,NA,NA,WOS:000425782400003,baumeister,post
DS,TH,NA,"Thomas, Kathleen Delaney",2017,FALSE,NA,No empirical data,TRUE,favourable,favourable,FALSE,NA,NA,NA,NA,NA,NA,WOS:000419802300005,baumeister,post
DS,TH,10.1002/cb.1646,"Janssen, Loes; Fennis, Bob M.",2017,FALSE,NA,Empirical data - laboratory study,FALSE,favourable,favourable,NA,NA,NA,NA,NA,NA,NA,WOS:000415350100016,baumeister,post
DS,TH,10.1037/emo0000218,"Low, Rachel S. T.; Overall, Nickola C.; Hammond, Matthew D.; Girme, Yuthika U.",2017,FALSE,NA,Empirical data - field study,FALSE,favourable,favourable,NA,NA,NA,NA,NA,NA,NA,WOS:000396000400004,baumeister,post
DS,TH,10.1123/jsep.2016-0274,"Kay, Sophie A.; Grimm, Lisa R.",2017,FALSE,NA,Empirical data - laboratory study,FALSE,favourable,favourable,NA,NA,NA,NA,NA,NA,NA,WOS:000407661300003,baumeister,post
DS,TH,10.1177/0193945917723828,"Hickman, Ronald L., Jr.; Pignatiello, Grant A.; Tahir, Sadia",2018,FALSE,NA,Empirical data - laboratory study,FALSE,favourable,favourable,NA,NA,NA,NA,NA,NA,NA,WOS:000419149700004,baumeister,post
DS,TH,10.1080/1359432X.2017.1417259,"Germeys, Lynn; De Gieter, Sara",2018,FALSE,NA,Empirical data - survey,FALSE,favourable,favourable,NA,NA,NA,NA,NA,NA,NA,WOS:000419954500011,baumeister,post
DS,TH,10.1080/09515089.2017.1291928,"Lumer, Christoph",2017,FALSE,NA,No empirical data,FALSE,unclassifiable,favourable,NA,NA,NA,NA,NA,NA,NA,WOS:000413930300006,baumeister,post
DS,TH,10.1146/annurev-soc-060116-053450,"Freese, Jeremy; Peterson, David",2017,FALSE,NA,No empirical data,TRUE,equivocal,equivocal,TRUE,TRUE,"Afterward, two social psychologists closely associated with ego depletion argued that “we understood our approval [of the project’s design] to mean ‘Sure, go ahead’ and not ‘Yes, that’s a definitive test of the phenomenon we’ve been studying all these years.’” (Baumeister & Vohs 2016, p. 574). In their view, ego depletion had been demonstrated by a variety of different experiments in different domains, and the failure to replicate this one experiment, no matter how comprehensive, did not undermine all these results",NA,NA,NA,NA,WOS:000407727700007,baumeister,post
DS,TH,10.1016/j.jcps.2017.03.004,"Lu, Fang-Chi; Sinha, Jayati",2017,FALSE,NA,Empirical data - laboratory study,FALSE,equivocal,unclassifiable,NA,NA,NA,NA,NA,NA,NA,WOS:000412380200001,baumeister,post
DS,TH,10.1177/1938965516668403,"Chan, Elisa K.; Kwortnik, Robert; Wansink, Brian",2017,FALSE,NA,Empirical data - laboratory study,FALSE,favourable,favourable,NA,NA,NA,NA,NA,NA,NA,WOS:000391804400002,baumeister,post
DS,TH,10.3389/fpsyg.2017.01367,"Goldberg, Simon B.; Flook, Lisa; Hirshberg, Matthew J.; Findley, David; Kesebir, Pelin; Schaefer, Stacey M.; Davidson, Richard J.",2017,FALSE,NA,Empirical data - laboratory study,TRUE,equivocal,equivocal,FALSE,NA,NA,NA,NA,NA,NA,WOS:000407545600001,baumeister,post
DS,TH,10.1017/prp.2017.1,"Zuo, Shijiang; Wang, Shun; Wang, Fang; Shi, Xiafei",2017,FALSE,NA,Empirical data - laboratory study,FALSE,favourable,favourable,NA,NA,NA,NA,NA,NA,NA,WOS:000399396300002,baumeister,post
DS,TH,10.5465/amj.2014.1142,"Ramarajan, Lakshmi; Rothbard, Nancy P.; Wilk, Steffanie L.",2017,FALSE,NA,Empirical data - laboratory study,FALSE,favourable,favourable,NA,NA,NA,NA,NA,NA,NA,WOS:000418761000008,baumeister,post
DS,TH,10.21909/sp.2017.02.737,"Halama, Peter",2017,TRUE,Cited in references but not in text,NA,NA,NA,NA,NA,NA,NA,NA,NA,NA,NA,WOS:000405680700006,baumeister,post
DS,TH,10.5465/amr.2014.0537,"Van Quaquebeke, Niels; Felps, Will",2018,FALSE,NA,No empirical data,FALSE,favourable,favourable,NA,NA,NA,NA,NA,NA,NA,WOS:000423840700002,baumeister,post
DS,TH,10.1027/1015-5759/a000290,"Maas, Joyce; Keijsers, Ger P. J.; Cangliosi, Claudia M.; van der Veld, William; Tanis-Jacobs, Jorg; van Minnen, Agnes",2017,FALSE,NA,Empirical data - survey,FALSE,unclassifiable,favourable,NA,NA,NA,NA,NA,NA,NA,WOS:000413949700003,baumeister,post
DS,TH,10.14689/ejer.2017.67.1,"Peker, Adem",2017,FALSE,NA,Empirical data - survey,FALSE,unclassifiable,unclassifiable,NA,NA,NA,NA,NA,NA,NA,WOS:000397581400002,baumeister,post
DS,TH,10.1002/mar.21078,"Fenton-O'Creevy, Mark; Dibb, Sally; Furnham, Adrian",2018,FALSE,NA,Empirical data - laboratory study,FALSE,favourable,favourable,NA,NA,NA,NA,NA,NA,NA,WOS:000424847400001,baumeister,post
DS,TH,10.1007/s12152-017-9335-6,"Daley, Ken; Howell, Robert",2018,FALSE,NA,No empirical data,TRUE,favourable,favourable,TRUE,TRUE,"Our view is that the replication concerns are real, but that the replication research to this point shouldn’t significantly undermine our confidence in the depletion hypothesis. It is certainly an overreaction to say that the hypothesis has been debunked. As Sripada, Kessler and Jonides [24] argue, the failure of replication does not impugn the majority of research. The depletion hypothesis has been borne out by many, many studies using a number of different protocols involving habit suppression and willpower in numerous domains.",TRUE,"Furthermore, as noted by Baumeister and Vohs, there are methodological issues with the replication studies. In particular, in their original study, subjects were ‘habituated’ to cross out all ‘e’s for some time before being asked to only cross out an ‘e’ if it was separated from another vowel by at least two letters. Acting against the prior habituation, they claim, is crucial to their original studies",NA,NA,WOS:000426078900001,baumeister,post
DS,TH,10.3389/fpsyg.2017.01672,"Arber, Madeleine M.; Ireland, Michael J.; Feger, Roy; Marrington, Jessica; Tehan, Joshua; Tehan, Gerald",2017,FALSE,NA,Empirical data - laboratory study,TRUE,unfavourable,unfavourable,FALSE,NA,NA,NA,NA,NA,NA,WOS:000411697700001,baumeister,post
DS,TH,10.1111/peps.12208,"Yue, Yumeng; Wang, Karyn L.; Groth, Markus",2017,FALSE,NA,Empirical data - laboratory study,FALSE,favourable,favourable,NA,NA,NA,NA,NA,NA,NA,WOS:000414335800002,baumeister,post
DS,TH,10.1037/ocp0000039,"Rivkin, Wladislaw; Diestel, Stefan; Schmidt, Klaus-Helmut",2018,FALSE,NA,Empirical data - laboratory study,FALSE,favourable,favourable,NA,NA,NA,NA,NA,NA,NA,WOS:000419973300008,baumeister,post
DS,TH,10.1016/j.healthplace.2016.12.005,"Clary, Christelle; Matthew, Stephen Augustus; Kestens, Yan",2017,FALSE,NA,Empirical data - laboratory study,FALSE,favourable,favourable,NA,NA,NA,NA,NA,NA,NA,WOS:000396955900001,baumeister,post
DS,TH,10.3389/fpsyg.2017.01290,"Englert, Chris; Zavery, Alafia; Bertrams, Alex",2017,FALSE,NA,No empirical data,TRUE,favourable,favourable,TRUE,TRUE,"given that a previous meta-analysis supported the strength model of self-control (Hagger et al., 2010)",TRUE,"Although the RRR has been criticized on theoretical and methodological levels (Baumeister and Vohs, 2016)",NA,NA,WOS:000406404100001,baumeister,post
DS,TH,10.1007/s10865-017-9848-9,"Batchelder, Abigail W.; Ehlinger, Peter P.; Boroughs, Michael S.; Shipherd, Jillian C.; Safren, Steven A.; Ironson, Gail H.; O'Cleirigh, Conall",2017,FALSE,NA,Empirical data - laboratory study,FALSE,favourable,favourable,NA,NA,NA,NA,NA,NA,NA,WOS:000411879300010,baumeister,post
DS,TH,10.1016/j.jebo.2017.02.014,"Kuhn, Michael A.; Kuhn, Peter; Villeval, Marie Claire",2017,FALSE,NA,Empirical data - laboratory study,FALSE,favourable,favourable,NA,NA,NA,NA,NA,NA,NA,WOS:000401595400005,baumeister,post
DS,TH,10.1007/s10964-017-0690-8,"Silva, Karol; Patrianakos, Jamie; Chein, Jason; Steinberg, Laurence",2017,FALSE,NA,Empirical data - laboratory study,TRUE,favourable,favourable,FALSE,NA,NA,NA,NA,NA,NA,WOS:000407995500002,baumeister,post
DS,TH,NA,"Xiao, Qian",2017,FALSE,NA,Empirical data - field study,FALSE,favourable,favourable,NA,NA,NA,NA,NA,NA,NA,WOS:000404468200007,baumeister,post
DS,TH,10.1016/j.evolhumbehav.2017.02.001,"Chiou, Wen-Bin; Wu, Wen-Hsiung; Cheng, Wen",2017,FALSE,NA,Empirical data - laboratory study,TRUE,equivocal,unfavourable,FALSE,NA,NA,NA,NA,NA,NA,WOS:000408291600006,baumeister,post
DS,TH,10.1287/mnsc.2015.2322,"Mochon, Daniel; Schwartz, Janet; Maroba, Josiase; Patel, Deepak; Ariely, Dan",2017,FALSE,NA,Empirical data - survey,FALSE,favourable,favourable,NA,NA,NA,NA,NA,NA,NA,WOS:000394360200004,baumeister,post
DS,TH,10.1111/joop.12191,"Kuhnel, Jana; Sonnentag, Sabine; Bledow, Ronald; Melchers, Klaus G.",2018,FALSE,NA,Empirical data - laboratory study,FALSE,favourable,favourable,NA,NA,NA,NA,NA,NA,NA,WOS:000424093800005,baumeister,post
DS,TH,10.1098/rsos.160605,"Capraro, Valerio; Corgnet, Brice; Espin, Antonio M.; Hernan-Gonzalez, Roberto",2017,FALSE,NA,Empirical data - laboratory study,FALSE,equivocal,equivocal,NA,NA,NA,NA,NA,NA,NA,WOS:000394469300013,baumeister,post
DS,TH,10.1037/fam0000239,"Moed, Anat; Dix, Theodore; Anderson, Edward R.; Greene, Shannon M.",2017,FALSE,NA,Empirical data - laboratory study,FALSE,favourable,equivocal,NA,NA,NA,NA,NA,NA,NA,WOS:000396001600010,baumeister,post
DS,TH,10.1002/ijop.12235,"Zhu, Ze; Li, Jian; Zhang, Bo; Li, Ye; Zhang, Houcan",2017,FALSE,NA,Empirical data - laboratory study,FALSE,favourable,equivocal,NA,NA,NA,NA,NA,NA,NA,WOS:000414617100003,baumeister,post
DS,TH,10.1016/j.jneb.2016.09.006,"Guthrie, Joanne F.",2017,FALSE,NA,No empirical data,FALSE,favourable,favourable,NA,NA,NA,NA,NA,NA,NA,WOS:000410804400013,baumeister,post
