PT,AU,BA,CA,GP,RI,OI,BE,Z2,TI,X1,Y1,Z1,FT,PN,AE,Z3,SO,S1,SE,BS,VL,IS,SI,MA,BP,EP,AR,DI,D2,SU,PD,PY,AB,X4,C1,Y4,Z4,AK,CT,CY,SP,CL,TC,Z8,ZB,ZS,Z9,SN,BN,WC,UT,PM
J,"Kolossa, Antonio; Kopp, Bruno",,,,,,,,Data quality over data quantity in computational cognitive neuroscience,,,,,,,,NEUROIMAGE,,,,172,,,,775,785,,10.1016/j.neuroimage.2018.01.005,,,MAY 15 2018,2018,"We analyzed factors that may hamper the advancement of computational cognitive neuroscience (CCN). These factors include a particular statistical mindset, which paves the way for the dominance of statistical power theory and a preoccupation with statistical replicability in the behavioral and neural sciences. Exclusive statistical concerns about sampling error occur at the cost of an inadequate representation of the problem of measurement error. We contrasted the manipulation of data quantity (sampling error, by varying the number of subjects) against the manipulation of data quality (measurement error, by varying the number of data per subject) in a simulated Bayesian model identifiability study. The results were clear-cut in showing that - across all levels of signal-to-noise ratios - varying the number of subjects was completely inconsequential, whereas the number of data per subject exerted massive effects on model identifiability. These results emphasize data quality over data quantity, and they call for the integration of statistics and measurement theory.",,"[Kolossa, Antonio; Kopp, Bruno] Hannover Med Sch, Dept Neurol, Carl Neuberg Str 1, D-30625 Hannover, Germany; [Kopp, Bruno] Hannover Med Sch, Dept Neurol, Carl Neuberg Str 1, D-30625 Hannover, Germany",,,,,,,,15,,,,,,,"Neurosciences; Neuroimaging; Radiology, Nuclear Medicine & Medical Imaging",WOS:000430364100065,
J,"Noah, Tom; Schul, Yaacov; Mayo, Ruth",,,,,,,,When Both the Original Study and Its Failed Replication Are Correct: Feeling Observed Eliminates the Facial-Feedback Effect,,,,,,,,JOURNAL OF PERSONALITY AND SOCIAL PSYCHOLOGY,,,,114,5,,,657,664,,10.1037/pspa0000121,,,May-18,2018,"This article suggests a theoretically driven explanation for a replication failure of one of the basic findings in psychology: the facial-feedback effect. According to the facial-feedback hypothesis, the facial activity associated with particular emotional expressions can influence people's affective experiences. Recently, a replication attempt of this effect in 17 laboratories around the world failed to find any support for the effect. We hypothesize that the reason for the failure of replication is that the replication protocol deviated from that of the original experiment in a critical factor. In all of the replication studies, participants were alerted that they would be monitored by a video camera, whereas the participants in the original study were not monitored, observed, or recorded. Previous findings indicate that feeling monitored or observed reduces reliance on internal cues in making judgments. Therefore, we hypothesize that recording the participants in the replication experiments reduced their reliance on the facial-feedback. To test the hypothesis, we replicated the facial-feedback experiment in 2 conditions: one with a video-camera and one without it. The results revealed a significant facial-feedback effect in the absence of a camera, which was eliminated in the camera's presence. These findings suggest that minute differences in the experimental protocol might lead to theoretically meaningful changes in the outcomes. In our view, the theoretical and methodological approach advocated by our study changes failed replications from being the ""end of the road"" regarding entire fields of study into a new road for growth regarding our understanding of human nature.",,"[Noah, Tom; Schul, Yaacov; Mayo, Ruth] Hebrew Univ Jerusalem, Dept Psychol, IL-9190501 Jerusalem, Israel; [Noah, Tom] Hebrew Univ Jerusalem, Federmann Ctr Study Rat, IL-9190501 Jerusalem, Israel; [Noah, Tom] Hebrew Univ Jerusalem, Dept Psychol, IL-9190501 Jerusalem, Israel; [Noah, Tom] Hebrew Univ Jerusalem, Federmann Ctr Study Rat, IL-9190501 Jerusalem, Israel",,,,,,,,36,,,,,,,"Psychology, Social",WOS:000430423100001,
J,"Krefeld-Schwalb, Antonia; Witte, Erich H.; Zenker, Frank",,,,,,,,Hypothesis-Testing Demands Trustworthy Data-A Simulation Approach to Inferential Statistics Advocating the Research Program Strategy,,,,,,,,FRONTIERS IN PSYCHOLOGY,,,,9,,,,,,460,10.3389/fpsyg.2018.00460,,,APR 24 2018,2018,"In psychology as elsewhere, the main statistical inference strategy to establish empirical effects is null-hypothesis significance testing (NHST). The recent failure to replicate allegedly well-established NHST-results, however, implies that such results lack sufficient statistical power, and thus feature unacceptably high error-rates. Using data-simulation to estimate the error-rates of NHST-results, we advocate the research program strategy (RPS) as a superior methodology. RPS integrates Frequentist with Bayesian inference elements, and leads from a preliminary discovery against a (random) H-0-hypothesis to a statistical H-1-verification. Not only do RPS-results feature significantly lower error-rates than NHST-results, RPS also addresses key-deficits of a ""pure"" Frequentist and a standard Bayesian approach. In particular, RPS aggregates underpowered results safely. RPS therefore provides a tool to regain the trust the discipline had lost during the ongoing replicability-crisis.",,"[Krefeld-Schwalb, Antonia] Univ Geneva, Geneva Sch Econ & Management, Geneva, Switzerland; [Witte, Erich H.] Univ Hamburg, Inst Psychol, Hamburg, Germany; [Zenker, Frank] Lund Univ, Dept Philosophy, Lund, Sweden; [Zenker, Frank] Lund Univ, Dept Philosophy, Lund, Sweden",,,,,,,,1,,,,,,,"Psychology, Multidisciplinary",WOS:000430831500001,
J,"Dijksterhuis, Ap",,,,,,,,Reflection on the Professor-Priming Replication Report,,,,,,,,PERSPECTIVES ON PSYCHOLOGICAL SCIENCE,,,,13,2,,,295,296,,10.1177/1745691618755705,,,Mar-18,2018,,,"[Dijksterhuis, Ap] Radboud Univ Nijmegen, Inst Behav Sci, Dept Social Psychol, Montessorilaan 3,POB 9104, NL-6500 HE Nijmegen, Netherlands; [Dijksterhuis, Ap] Radboud Univ Nijmegen, Inst Behav Sci, Dept Social Psychol, Montessorilaan 3,POB 9104, NL-6500 HE Nijmegen, Netherlands",,,,,,,,3,,,,,,,"Psychology, Multidisciplinary",WOS:000429909000027,
J,"Soderkvist, Sven; Ohlen, Kajsa; Dimberg, Ulf",,,,,,,,How the Experience of Emotion is Modulated by Facial Feedback,,,,,,,,JOURNAL OF NONVERBAL BEHAVIOR,,,,42,1,,,129,151,,10.1007/s10919-017-0264-1,,,Mar-18,2018,"The facial feedback hypothesis states that facial actions modulate subjective experiences of emotion. Using the voluntary facial action technique, in which the participants react with instruction induced smiles and frowns when exposed to positive and negative emotional pictures and then rate the pleasantness of these stimuli, four questions were addressed in the present study. The results in Experiment 1 demonstrated a feedback effect because participants experienced the stimuli as more pleasant during smiling as compared to when frowning. However, this effect was present only during the critical actions of smiling and frowning, with no remaining effects after 5 min or after 1 day. In Experiment 2, feedback effects were found only when the facial action (smile/frown) was incongruent with the presented emotion (positive/negative), demonstrating attenuating but not enhancing modulation. Finally, no difference in the intensity of produced feedback effect was found between smiling and frowning, and no difference in feedback effect was found between positive and negative emotions. In conclusion, facial feedback appears to occur mainly during actual facial actions, and primarily attenuate ongoing emotional states.",,"[Soderkvist, Sven; Ohlen, Kajsa; Dimberg, Ulf] Uppsala Univ, Dept Psychol, Box 1225, S-75142 Uppsala, Sweden; [Soderkvist, Sven] Uppsala Univ, Dept Psychol, Box 1225, S-75142 Uppsala, Sweden",,,,,,,,8,,,,,,,"Psychology, Social",WOS:000425296000007,
J,"Vrijhof, Claudia I.; van der Voort, Anja; van IJzendoorn, Marinus H.; Euser, Saskia",,,,,,,,Stressful Family Environments and Children's Behavioral Control: A Multimethod Test and Replication Study With Twins,,,,,,,,JOURNAL OF FAMILY PSYCHOLOGY,,,,32,1,,,49,59,,10.1037/fam0000345,,,Feb-18,2018,"Young children's behavioral control predicts a broad range of developmental outcomes in child-and adulthood. It is therefore important to study how individual differences in behavioral control arise. Previous studies suggest that there are both genetic and environmental influences, which were estimated in the current study using a sample of mono-and dizygotic same-sex twins. Furthermore, we examined the associations between indicators of a stressful family environment like household chaos, parenting daily hassles, and parental depressive symptoms and children's behavioral control in 2 samples. Children of the same twin pair were randomly divided over 2 samples; a test (N = 201, 48.3% boys, M age 46.53 months) and replication sample (N = 201, 49.8% boys, M age 46.06 months). Both parents reported on their children's effortful control via the Child Behavior Questionnaire and children's cheating behavior was observed during a throwing game. We found that AE models fitted the data for effortful control (A = 31%, E = 69%) and cheating (A = 16%, E = 84%) best. Path analyses revealed that children of parents experiencing more parenting daily hassles and depressive symptoms had lower levels of effortful control in the test sample. Furthermore, we found that children growing up in more chaotic households (parent report) had an increased risk of being in the cheating group versus the possible intention to cheat group in the test sample. These results were partially replicated. We suggest that the role of stressful family environments in the development of behavioral control should be considered when setting up prevention and intervention programs targeting children's behavioral control.",,"[Vrijhof, Claudia I.; van IJzendoorn, Marinus H.; Euser, Saskia] Leiden Univ, Inst Educ & Child Studies, Leiden Consortium Individual Dev, Pieter de la Court Gebouw,Postbus 9555, NL-2300 RB Leiden, Netherlands; [Vrijhof, Claudia I.; van der Voort, Anja; van IJzendoorn, Marinus H.; Euser, Saskia] Leiden Univ, Ctr Child & Family Studies, Inst Educ & Child Studies, Pieter de la Court Gebouw,Postbus 9555, NL-2300 RB Leiden, Netherlands; [van IJzendoorn, Marinus H.] Leiden Univ, Inst Educ & Child Studies, Leiden Consortium Individual Dev, Pieter de la Court Gebouw,Postbus 9555, NL-2300 RB Leiden, Netherlands; [van IJzendoorn, Marinus H.] Leiden Univ, Ctr Child & Family Studies, Inst Educ & Child Studies, Pieter de la Court Gebouw,Postbus 9555, NL-2300 RB Leiden, Netherlands",,,,,,,,4,,,,,,,"Psychology, Clinical; Family Studies",WOS:000427608700007,
J,"Voelkl, Bernhard; Vogt, Lucile; Sena, Emily S.; Wurbel, Hanno",,,,,,,,Reproducibility of preclinical animal research improves with heterogeneity of study samples,,,,,,,,PLOS BIOLOGY,,,,16,2,,,,,e2003693,10.1371/journal.pbio.2003693,,,Feb-18,2018,"Single-laboratory studies conducted under highly standardized conditions are the gold standard in preclinical animal research. Using simulations based on 440 preclinical studies across 13 different interventions in animal models of stroke, myocardial infarction, and breast cancer, we compared the accuracy of effect size estimates between single-laboratory and multi-laboratory study designs. Single-laboratory studies generally failed to predict effect size accurately, and larger sample sizes rendered effect size estimates even less accurate. By contrast, multi-laboratory designs including as few as 2 to 4 laboratories increased coverage probability by up to 42 percentage points without a need for larger sample sizes. These findings demonstrate that within-study standardization is a major cause of poor reproducibility. More representative study samples are required to improve the external validity and reproducibility of preclinical animal research and to prevent wasting animals and resources for inconclusive research.",,"[Voelkl, Bernhard; Vogt, Lucile; Wurbel, Hanno] Univ Bern, VPH Inst, Vetsuisse Fac, Div Anim Welf, Bern, Switzerland; [Sena, Emily S.] Univ Edinburgh, Ctr Clin Brain Sci, Chancellors Bldg, Edinburgh, Midlothian, Scotland; [Wurbel, Hanno] Univ Bern, VPH Inst, Vetsuisse Fac, Div Anim Welf, Bern, Switzerland",,,,,,,,68,,,,,,,Biochemistry & Molecular Biology; Biology,WOS:000426253300008,
J,"Zhou, Yuefang; Fischer, Martin H.",,,,,,,,Mimicking non-verbal emotional expressions and empathy development in simulated consultations: An experimental feasibility study,,,,,,,,PATIENT EDUCATION AND COUNSELING,,,,101,2,,,304,309,,10.1016/j.pec.2017.08.016,,,Feb-18,2018,"Objective: To explore the feasibility of applying an experimental design to study the relationship between non-verbal emotions and empathy development in simulated consultations. Method: In video-recorded simulated consultations, twenty clinicians were randomly allocated to either an experimental group (instructed to mimic non-verbal emotions of a simulated patient, SP) or a control group (no such instruction). Baseline empathy scores were obtained before consultation, relational empathy was rated by SP after consultation. Multilevel logistic regression modelled the probability of mimicry occurrence, controlling for baseline empathy and clinical experience. ANCOVA compared group differences on relational empathy and consultation smoothness. Results: Instructed mimicry lasted longer than spontaneous mimicry. Mimicry was marginally related to improved relational empathy. SP felt being treated more like a whole person during consultations with spontaneous mimicry. Clinicians who displayed spontaneous mimicry felt consultations went more smoothly. Conclusion: The experimental approach improved our understanding of how non-verbal emotional mimicry contributed to relational empathy development during consultations. Further work should ascertain the potential of instructed mimicry to enhance empathy development. Practice implications: Understanding how non-verbal emotional mimicry impacts on patients' perceived clinician empathy during consultations may inform training and intervention programme development. (C) 2017 Elsevier B.V. All rights reserved.",,"[Zhou, Yuefang] Univ St Andrews, Sch Med, St Andrews KY16 9TF, Fife, Scotland; [Zhou, Yuefang; Fischer, Martin H.] Univ Potsdam, Dept Psychol, Potsdam, Germany; [Zhou, Yuefang] Univ St Andrews, Sch Med, St Andrews KY16 9TF, Fife, Scotland",,,,,,,,3,,,,,,,"Public, Environmental & Occupational Health; Social Sciences, Interdisciplinary",WOS:000426445700017,
J,"Tillman, Richard; Louwerse, Max",,,,,,,,Estimating Emotions Through Language Statistics and Embodied Cognition,,,,,,,,JOURNAL OF PSYCHOLINGUISTIC RESEARCH,,,,47,1,,,159,167,,10.1007/s10936-017-9522-y,,,Feb-18,2018,"Recent research has suggested that language processing activates perceptual simulations. We have demonstrated that findings that have been attributed to an embodied cognition account can also be explained by language statistics, because language encodes perceptual information. We investigated whether comprehension of emotion words can be explained by an embodied cognition or a language statistics account. A corpus linguistic study comparing emotions words showed that words denoting the same emotions (happy-delighted) co-occur more frequently than different emotions (happy-angry). These findings were used in two experiments in which participants read same-emotion and different-emotion sentence pairs. Sentence pairs with different emotions yielded longer RTs than sentences with the same emotions both in a cognitive task tailored toward linguistic representations and a task tailored toward embodied representations. These findings contribute to a growing body of literature that demonstrates that language processing does not always rely solely on perceptual simulation.",,"[Tillman, Richard] Univ Cincinnati, Dept Psychol, POB 210376, Cincinnati, OH 45221 USA; [Louwerse, Max] Tilburg Univ, Tilburg Ctr Cognit & Commun, POB 90153, NL-5000 LE Tilburg, Netherlands; [Tillman, Richard] Univ Cincinnati, Dept Psychol, POB 210376, Cincinnati, OH 45221 USA",,,,,,,,6,,,,,,,"Linguistics; Psychology, Experimental",WOS:000424220500009,
J,"Berndt, Eduard; Dudschig, Carolin; Kaup, Barbara",,,,,,,,Activating concepts by activating experiential traces: investigations with a series of anagram solution tasks,,,,,,,,QUARTERLY JOURNAL OF EXPERIMENTAL PSYCHOLOGY,,,,71,2,,,483,498,,10.1080/17470218.2016.1261913,,,Feb-18,2018,"According to the experiential-simulations view of language, words automatically activate experiential traces that stem from the reader's interactions with their referents. Here, we focus on the corresponding influence in the opposite direction. By means of an anagram-solving task we investigated whether activating spatial experiential traces would activate the corresponding concepts, which in turn facilitates access to associated words. Participants solved anagrams of nouns associated with the ocean or the sky (e.g. dolphin=dplhion or cloud=cdulo). In six experiments we provided additional context information such as positional information (presenting the anagram at the top or the bottom of the screen), or pictorial information that either matched the ocean and sky theme or not, or both positional and pictorial information. Anagrams were solved faster when the position of the anagram was congruent with the location of the noun's referent in the real world, but only when presented on the background of an ocean-sky picture. Thus, activating experiential traces indeed seems to activate related concepts but positional information alone is not enough to find facilitation in an anagram solving task. Rather what is needed is a whole set of traces that sufficiently narrow down the number of related concepts.",,"[Berndt, Eduard; Dudschig, Carolin; Kaup, Barbara] Univ Tubingen, Psychol Inst, Schleichstr 4, D-72076 Tubingen, Germany; [Berndt, Eduard] Univ Tubingen, Psychol Inst, Schleichstr 4, D-72076 Tubingen, Germany",,,,,,,,2,,,,,,,"Psychology, Biological; Physiology; Psychology; Psychology, Experimental",WOS:000423317700013,
J,"Zwaan, Rolf A.; Etz, Alexander; Lucas, Richard E.; Donnellan, M. Brent",,,,,,,,Making replication mainstream,,,,,,,,BEHAVIORAL AND BRAIN SCIENCES,,,,41,,,,,,e120,10.1017/S0140525X17001972,,,2018,2018,"Many philosophers of science and methodologists have argued that the ability to repeat studies and obtain similar results is an essential component of science. A finding is elevated from single observation to scientific evidence when the procedures that were used to obtain it can be reproduced and the finding itself can be replicated. Recent replication attempts show that some high profile results - most notably in psychology, but in many other disciplines as well - cannot be replicated consistently. These replication attempts have generated a considerable amount of controversy, and the issue of whether direct replications have value has, in particular, proven to be contentious. However, much of this discussion has occurred in published commentaries and social media outlets, resulting in a fragmented discourse. To address the need for an integrative summary, we review various types of replication studies and then discuss the most commonly voiced concerns about direct replication. We provide detailed responses to these concerns and consider different statistical ways to evaluate replications. We conclude there are no theoretical or statistical obstacles to making direct replication a routine aspect of psychological science.",,"[Zwaan, Rolf A.] Erasmus Univ, Dept Psychol Educ & Child Sci, NL-3000 DR Rotterdam, Netherlands; [Etz, Alexander] Univ Calif Irvine, Dept Cognit Sci, Irvine, CA 92697 USA; [Lucas, Richard E.; Donnellan, M. Brent] Michigan State Univ, Dept Psychol, Psychol Bldg,316 Phys Rd,Room 249A, E Lansing, MI 48824 USA; [Donnellan, M. Brent] Texas A&M Univ, Dept Psychol, College Stn, TX 77843 USA; [Zwaan, Rolf A.] Erasmus Univ, Dept Psychol Educ & Child Sci, NL-3000 DR Rotterdam, Netherlands",,,,,,,,113,,,,,,,"Psychology, Biological; Behavioral Sciences; Neurosciences",WOS:000458790700035,
J,"Nelson, Leif D.; Simmons, Joseph; Simonsohn, Uri",,,,,,,,Psychology's Renaissance,,,,,,,,Annual Review of Psychology,,,,69,,,,511,534,,10.1146/annurev-psych-122216-011836,,,2018,2018,"In 2010-2012, a few largely coincidental events led experimental psychologists to realize that their approach to collecting, analyzing, and reporting data made it too easy to publish false-positive findings. This sparked a period of methodological reflection that we review here and call Psychology's Renaissance. We begin by describing how psychologists' concerns with publication bias shifted from worrying about file-drawered studies to worrying about p-hacked analyses. We then review the methodological changes that psychologists have proposed and, in some cases, embraced. In describing how the renaissance has unfolded, we attempt to describe different points of view fairly but not neutrally, so as to identify the most promising paths forward. In so doing, we champion disclosure and preregistration, express skepticism about most statistical solutions to publication bias, take positions on the analysis and interpretation of replication failures, and contend that meta-analytical thinking increases the prevalence of false positives. Our general thesis is that the scientific practices of experimental psychologists have improved dramatically.",,"[Nelson, Leif D.] Univ Calif Berkeley, Haas Sch Business, Berkeley, CA 94720 USA; [Simmons, Joseph; Simonsohn, Uri] Univ Penn, Wharton Sch, Philadelphia, PA 19104 USA; [Nelson, Leif D.] Univ Calif Berkeley, Haas Sch Business, Berkeley, CA 94720 USA",,,,,,,,156,,,,,,,"Psychology; Psychology, Multidisciplinary",WOS:000424143700022,
J,"Cracco, Emiel; Genschow, Oliver; Radkova, Ina; Brass, Marcel",,,,,,,,Automatic imitation of pro- and antisocial gestures: Is implicit social behavior censored?,,,,,,,,COGNITION,,,,170,,,,179,189,,10.1016/j.cognition.2017.09.019,,,Jan-18,2018,"According to social reward theories, automatic imitation can be understood as a means to obtain positive social consequences. In line with this view, it has been shown that automatic imitation is modulated by contextual variables that constrain the positive outcomes of imitation. However, this work has largely neglected that many gestures have an inherent pro- or antisocial meaning. As a result of their meaning, antisocial gestures are considered taboo and should not be used in public. In three experiments, we show that automatic imitation of symbolic gestures is modulated by the social intent of these gestures. Experiment 1 (N = 37) revealed reduced automatic imitation of antisocial compared with prosocial gestures. Experiment 2 (N = 118) and Experiment 3 (N = 118) used a social priming procedure to show that this effect was stronger in a prosocial context than in an antisocial context. These findings were supported in a within-study meta-analysis using both frequentist and Bayesian statistics. Together, our results indicate that automatic imitation is regulated by internalized social norms that act as a stop signal when inappropriate actions are triggered.",,"[Cracco, Emiel; Radkova, Ina; Brass, Marcel] Univ Ghent, Dept Expt Psychol, Henri Dunantlaan 2, B-9000 Ghent, Belgium; [Genschow, Oliver] Univ Cologne, Social Cognit Ctr Cologne, Cologne, Germany; [Cracco, Emiel] Univ Ghent, Dept Expt Psychol, Henri Dunantlaan 2, B-9000 Ghent, Belgium",,,,,,,,19,,,,,,,"Psychology, Experimental",WOS:000418979600016,
J,"Wildschut, Tim; Sedikides, Constantine; Robertson, Sara",,,,,,,,Sociality and intergenerational transfer of older adults' nostalgia,,,,,,,,MEMORY,,,,26,8,,,1030,1041,,10.1080/09658211.2018.1470645,,,2018,2018,"Interest in nostalgia has blossomed, yet its nature in older adulthood and potential for intergenerational transfer to younger adults has remained neglected. In Experiment 1, we focused on the content of older adults' nostalgic (vs. ordinary) recollections and asked whether older adults' nostalgia could be transferred to younger adults. We showed that nostalgia expressed in older adults' narratives was positively associated with nostalgia reported by young-adult readers. In Experiment 2, undergraduates read a nostalgic or ordinary narrative written by an older adult. Then they rated their own nostalgia as well as their perceived social connectedness, self-continuity, and meaning in life. Exposure to older adults' nostalgic (vs. ordinary) narratives promoted concurrent nostalgia among young adults, along with associated psychological benefits (social connectedness, self-continuity, meaning). The findings illustrate the potential for intergenerational transfer of nostalgia through written narratives, and attest to the universality of nostalgic themes across younger and older adults.",,"[Wildschut, Tim; Sedikides, Constantine; Robertson, Sara] Univ Southampton, Dept Psychol, Southampton, Hants, England; [Wildschut, Tim] Univ Southampton, Dept Psychol, Ctr Res Self & Ident, Southampton SO17 1BJ, Hants, England",,,,,,,,6,,,,,,,"Psychology, Experimental",WOS:000435699500002,
