PT,AU,BA,CA,GP,RI,OI,BE,Z2,TI,X1,Y1,Z1,FT,PN,AE,Z3,SO,S1,SE,BS,VL,IS,SI,MA,BP,EP,AR,DI,D2,SU,PD,PY,AB,X4,C1,Y4,Z4,AK,CT,CY,SP,CL,TC,Z8,ZB,ZS,Z9,SN,BN,WC,UT,PM
J,"Oberauer, Klaus; Lewandowsky, Stephan",,,,,,,,Addressing the theory crisis in psychology,,,,,,,,PSYCHONOMIC BULLETIN & REVIEW,,,,26,5,,,1596,1618,,10.3758/s13423-019-01645-2,,,Oct-19,2019,"A worrying number of psychological findings are not replicable. Diagnoses of the causes of this ""replication crisis,"" and recommendations to address it, have nearly exclusively focused on methods of data collection, analysis, and reporting. We argue that a further cause of poor replicability is the often weak logical link between theories and their empirical tests. We propose a distinction between discovery-oriented and theory-testing research. In discovery-oriented research, theories do not strongly imply hypotheses by which they can be tested, but rather define a search space for the discovery of effects that would support them. Failures to find these effects do not question the theory. This endeavor necessarily engenders a high risk of Type I errors-that is, publication of findings that will not replicate. Theory-testing research, by contrast, relies on theories that strongly imply hypotheses, such that disconfirmation of the hypothesis provides evidence against the theory. Theory-testing research engenders a smaller risk of Type I errors. A strong link between theories and hypotheses is best achieved by formalizing theories as computational models. We critically revisit recommendations for addressing the ""replication crisis,"" including the proposal to distinguish exploratory from confirmatory research, and the preregistration of hypotheses and analysis plans.",,"[Oberauer, Klaus] Univ Zurich, Dept Psychol Cognit Psychol, Binzmuhlestr 14-22, CH-8050 Zurich, Switzerland; [Lewandowsky, Stephan] Univ Bristol, Bristol, Avon, England; [Lewandowsky, Stephan] Univ Western Australia, Crawley, Australia; [Oberauer, Klaus] Univ Zurich, Dept Psychol Cognit Psychol, Binzmuhlestr 14-22, CH-8050 Zurich, Switzerland",,,,,,,,33,,,,,,,"Psychology, Mathematical; Psychology, Experimental",WOS:000491200700007,
J,"Rouder, Jeffrey N.; Haaf, Julia M.; Davis-Stober, Clintin P.; Hilgard, Joseph",,,,,,,,Beyond Overall Effects: A Bayesian Approach to Finding Constraints in Meta-Analysis,,,,,,,,PSYCHOLOGICAL METHODS,,,,24,5,,,606,621,,10.1037/met0000216,,,Oct-19,2019,"Most meta-analyses focus on the behavior of meta-analytic means. In many cases, however, this mean is difficult to defend as a construct because the underlying distribution of studies reflects many factors, including how we as researchers choose to design studies. We present an alternative goal for metaanalysis. The analyst may ask about relations that are stable across all the studies. In a typical meta-analysis, there is a hypothesized direction (e.g., that violent video games increase, rather than decrease, aggressive behavior). We ask whether all studies in a meta-analysis have true effects in the hypothesized direction. If so, this is an example of a stable relation across all the studies. We propose 4 models: (a) all studies are truly null; (b) all studies share a single true nonzero effect; (c) studies differ. but all true effects are in the same direction; and (d) some study effects are truly positive, whereas others are truly negative. We develop Bayes factor model comparison for these models and apply them to 4 extant meta-analyses to show their usefulness.",,"[Rouder, Jeffrey N.] Univ Calif Irvine, Dept Cognit Sci, Irvine, CA USA; [Haaf, Julia M.; Davis-Stober, Clintin P.] Univ Missouri, Dept Psychol Sci, Columbia, MO 65211 USA; [Hilgard, Joseph] Illinois State Univ, Dept Psychol, Normal, IL 61761 USA; [Rouder, Jeffrey N.] Univ Calif Irvine, Dept Cognit Sci, Social & Behav Sci Gateway, Irvine, CA 92697 USA",,,,,,,,3,,,,,,,"Psychology, Multidisciplinary",WOS:000488839300007,
J,"Pek, Jolynn; Van Zandt, Trisha",,,,,,,,Frequentist and Bayesian approaches to data analysis: Evaluation and estimation,,,,,,,,PSYCHOLOGY LEARNING AND TEACHING-PLAT,,,,19,1,,,21,35,1.47573E+15,10.1177/1475725719874542,,,Mar-20,2020,"Statistical thinking is essential to understanding the nature of scientific results as a consumer. Statistical thinking also facilitates thinking like a scientist. Instead of emphasizing a ""correct"" procedure for data analysis and its outcome, statistical thinking focuses on the process of data analysis. This article reviews frequentist and Bayesian approaches such that teachers can promote less well-known statistical perspectives to encourage statistical thinking. Within the frequentist and Bayesian approaches, we highlight important distinctions between statistical evaluation versus estimation using an example on the facial feedback hypothesis. We first introduce some elementary statistical concepts, which are then illustrated with simulated data. Finally, we demonstrate how these approaches are applied to empirical data obtained from a Registered Replication Report. Data and R code for the example are provided as supplementary teaching material. We conclude with a discussion of key learning outcomes centred on promoting statistical thinking.",,"[Pek, Jolynn; Van Zandt, Trisha] Ohio State Univ, Dept Psychol, 228 Lazenby Hall,1827 Neil Ave, Columbus, OH 43210 USA; [Pek, Jolynn] Ohio State Univ, Dept Psychol, 228 Lazenby Hall,1827 Neil Ave, Columbus, OH 43210 USA",,,,,,,,1,,,,,,,"Psychology, Multidisciplinary",WOS:000488434100001,
J,"Charles, Sarah J.; Bartlett, James E.; Messick, Kyle J.; Coleman, Thomas J., III; Uzdavines, Alex",,,,,,,,Researcher Degrees of Freedom in the Psychology of Religion,,,,,,,,INTERNATIONAL JOURNAL FOR THE PSYCHOLOGY OF RELIGION,,,,29,4,,,230,245,,10.1080/10508619.2019.1660573,,,OCT 2 2019,2019,"There is a push in psychology toward more transparent practices, stemming partially as a response to the replication crisis. We argue that the psychology of religion should help lead the way toward these new, more transparent practices to ensure a robust and dynamic subfield. One of the major issues that proponents of Open Science practices hope to address is researcher degrees of freedom (RDF). We pre-registered and conducted a systematic review of the 2017 issues from three psychology of religion journals. We aimed to identify the extent to which the psychology of religion has embraced Open Science practices and the role of RDF within the subfield. We found that many of the methodologies that help to increase transparency, such as pre-registration, have yet to be adopted by those in the subfield. In light of these findings, we present recommendations for addressing the issue of transparency in the psychology of religion and outline how to move toward these new Open Science practices.",,"[Charles, Sarah J.; Bartlett, James E.; Messick, Kyle J.; Coleman, Thomas J., III] Coventry Univ, Ctr Adv Behav Sci, Brain Belief & Behav Res Lab, Cheetah Rd, Coventry CV1 2TL, W Midlands, England; [Bartlett, James E.] Arden Univ, Sch Psychol Law & Social Sci, Coventry, W Midlands, England; [Coleman, Thomas J., III] Grand Valley State Univ, Dept Psychol, Allendale, MI 49401 USA; [Uzdavines, Alex] Case Western Reserve Univ, Dept Psychol Sci, Cleveland, OH 44106 USA; [Charles, Sarah J.] Coventry Univ, Ctr Adv Behav Sci, Brain Belief & Behav Res Lab, Cheetah Rd, Coventry CV1 2TL, W Midlands, England",,,,,,,,6,,,,,,,"Psychology, Multidisciplinary; Religion",WOS:000488385100001,
J,"Vadillo, Miguel A.",,,,,,,,Ego Depletion May Disappear by 2020,,,,,,,,SOCIAL PSYCHOLOGY,,,,50,6-May,,,282,291,,10.1027/1864-9335/a000375,,,Sep-19,2019,"Ego depletion has been successfully replicated in hundreds of studies. Yet the most recent large-scale Registered Replication Reports (RRR), comprising thousands of participants, have yielded disappointingly small effects, sometimes even failing to reach statistical significance. Although these results may seem surprising, in the present article I suggest that they are perfectly consistent with a long-term decline in the size of the depletion effects that can be traced back to at least 10 years ago, well before any of the RRR on ego depletion were conceived. The decline seems to be at least partly due to a parallel trend toward publishing better and less biased research.",,"[Vadillo, Miguel A.] Univ Autonoma Madrid, Dept Psicol Bas, Fac Psicol, E-28049 Madrid, Spain; [Vadillo, Miguel A.] Univ Autonoma Madrid, Dept Psicol Bas, Fac Psicol, E-28049 Madrid, Spain",,,,,,,,4,,,,,,,"Psychology, Social",WOS:000495020100002,
J,"Inzlicht, Michael; Friese, Malte",,,,,,,,"The Past, Present, and Future of Ego Depletion",,,,,,,,SOCIAL PSYCHOLOGY,,,,50,6-May,,,370,378,,10.1027/1864-9335/a000398,,,Sep-19,2019,"At the center of social psychology just a few years ago, ego depletion is now widely seen as a controversial topic, one of the chief victims of the replication crisis. Despite over 600 studies of apparent support, many are now asking if ego depletion is even real. Here, we comment on the articles included in this Special Issue: Ego Depletion and Self-Control: Conceptual and Empirical Advances. Specifically, we delineate the contributions and limitations of these articles by embedding them in a brief history of ego depletion, describing the current state of uncertainty about ego depletion's scientific status, and outlining necessary steps for the study of ego depletion to have a healthy future. To us, the most troubling aspect of this controversy is not what it suggests about ego depletion, but what it suggests about social psychology more broadly. If the mere existence of ego depletion is seriously doubted by many, what can be confidently regarded as real in social psychology? By increasing the precision of our theories, continuously validating our manipulations and measures, and practicing the full suite of open science practices, we have the potential to identify legitimate and robust effects and build a cumulative and trustworthy psychological science.",,"[Inzlicht, Michael] Univ Toronto, Dept Psychol, 1265 Mil Trail, Toronto, ON M1C 1A3, Canada; [Friese, Malte] Saarland Univ, Dept Psychol, D-66123 Saarbrucken, Germany; [Inzlicht, Michael] Univ Toronto, Dept Psychol, 1265 Mil Trail, Toronto, ON M1C 1A3, Canada; [Friese, Malte] Saarland Univ, Dept Psychol, D-66123 Saarbrucken, Germany",,,,,,,,13,,,,,,,"Psychology, Social",WOS:000495020100009,
J,"Vosgerau, Joachim; Simonsohn, Uri; Nelson, Leif D.; Simmons, Joseph P.",,,,,,,,"99% Impossible: A Valid, or Falsifiable, Internal Meta-Analysis",,,,,,,,JOURNAL OF EXPERIMENTAL PSYCHOLOGY-GENERAL,,,,148,9,,,1628,1639,,10.1037/xge0000663,,,Sep-19,2019,"Several researchers have relied on. or advocated for, internal meta-analysis, which involves statistically aggregating multiple studies in a paper to assess their overall evidential value. Advocates of internal meta-analysis argue that it provides an efficient approach to increasing statistical power and solving the file-drawer problem. here we show that the validity of internal meta-analysis rests on the assumption that no studies or analyses were selectively reported. That is, the technique is only valid if (a) all conducted studies were included (i.e., an empty file drawer), and (b) for each included study, exactly one analysis was attempted (i.e., there was no p-hacking). We show that even very small doses of selective reporting invalidate internal meta-analysis. For example, the kind of minimal p-hacking that increases the false-positive rate of 1 study to just 8% increases the false-positive rate of a 10-study internal meta-analysis to 83%. If selective reporting is approximately zero, but not exactly zero, then internal meta-analysis is invalid. To be valid, (a) an internal meta-analysis would need to contain exclusively studies that were properly preregistered, (b) those preregistrations would have to be followed in all essential aspects, and (c) the decision of whether to include a given study in an internal meta-analysis would have to be made before any of those studies are run.",,"[Vosgerau, Joachim] Bocconi Univ, Dept Mkt, Via Roentgen 1, I-20136 Milan, Italy; [Simonsohn, Uri] Ramon Llull Univ, ESADE Business Sch, Barcelona, Spain; [Nelson, Leif D.] Univ Calif Berkeley, Haas Sch Business, Berkeley, CA 94720 USA; [Simmons, Joseph P.] Univ Penn, Wharton Sch, Philadelphia, PA 19104 USA; [Vosgerau, Joachim] Bocconi Univ, Dept Mkt, Via Roentgen 1, I-20136 Milan, Italy",,,,,,,,10,,,,,,,"Psychology, Experimental",WOS:000483067500012,
J,"Jekel, Marc; Fiedler, Susann; Torras, Ramona Allstadt; Mischkowski, Dorothee; Dorrough, Angela Rachael; Gloeckner, Andreas",,,,,,,,How to Teach Open Science Principles in the Undergraduate Curriculum-The Hagen Cumulative Science Project,,,,,,,,PSYCHOLOGY LEARNING AND TEACHING-PLAT,,,,19,1,,,91,106,1.47573E+15,10.1177/1475725719868149,,,Mar-20,2020,"The Hagen Cumulative Science Project is a large-scale replication project based on students' thesis work. In the project, we aim to (a) teach students to conduct the entire research process for conducting a replication according to open science standards and (b) contribute to cumulative science by increasing the number of direct replications. We describe the procedural steps of the project from choosing suitable replication studies to guiding students through the process of conducting a replication, and processing results in a meta-analysis. Based on the experience of more than 80 replications, we summarize how such a project can be implemented. We present practical solutions that have been shown to be successful as well as discuss typical obstacles and how they can be solved. We argue that replication projects are beneficial for all groups involved: Students benefit by being guided through a highly structured protocol and making actual contributions to science. Instructors benefit by using time resources effectively for cumulative science and fulfilling teaching obligations in a meaningful way. The scientific community benefits from the resulting greater number of replications and teaching state-of-the-art methodology. We encourage the use of student thesis-based replication projects for thesis work in academic bachelor and master curricula.",,"[Jekel, Marc; Dorrough, Angela Rachael] Univ Cologne, Cologne, Germany; [Fiedler, Susann] Max Planck Inst Collect Goods, Gielen Leyendecker Res Grp, Bonn, Germany; [Torras, Ramona Allstadt] Univ Hagen, Hagen, Germany; [Torras, Ramona Allstadt] Univ Bonn, Bonn, Germany; [Mischkowski, Dorothee] Univ Cologne, Psychol Dept Social Psychol, Cologne, Germany; [Gloeckner, Andreas] Univ Cologne, Social Psychol, Cologne, Germany; [Gloeckner, Andreas] Max Planck Inst Collect Goods, Bonn, Germany; [Torras, Ramona Allstadt] Univ Cologne, Dept Psychol, Cologne, Germany; [Mischkowski, Dorothee] Univ Gottingen, Gottingen, Germany; [Jekel, Marc] Univ Cologne, Social Cognit Ctr Cologne, Richard Strauss Str 2, D-50931 Cologne, Germany",,,,,,,,2,,,,,,,"Psychology, Multidisciplinary",WOS:000482870200001,
J,"Bulnes, L. C.; Marien, P.; Vandekerckhove, M.; Cleeremans, A.",,,,,,,,The effects of Botulinum toxin on the detection of gradual changes in facial emotion,,,,,,,,SCIENTIFIC REPORTS,,,,9,,,,,,11734,10.1038/s41598-019-48275-1,,,AUG 13 2019,2019,"When we feel sad or depressed, our face invariably ""drops"". Conversely, when we try to cheer someone up, we might tell them ""keep your smile up"", so presupposing that modifying the configuration of their facial muscles will enhance their mood. A crucial assumption that underpins this hypothesis is that mental states are shaped by information originating from the peripheral neuromotor system - a view operationalised as the Facial Feedback Hypothesis. We used botulinum toxin (BoNT-A) injected over the frown area to temporarily paralyse muscles necessary to express anger. Using a pre-post treatment design, we presented participants with gradually changing videos of a face morphing from neutral to full-blown expressions of either anger or happiness and asked them to press a button as soon as they had detected any change in the display. Results indicate that while all participants (control and BoNT-A) improved their reaction times from pre-test to post-test, the BoNT-A group did not when detecting anger in the post-test. We surmise that frown paralysis disadvantaged participants in their ability to improve the detection of anger. Our finding suggests that facial feedback causally affects perceptual awareness of changes in emotion, as well as people's ability to use perceptual information to learn.",,"[Bulnes, L. C.; Cleeremans, A.] Univ Libre Bruxelles, Consciousness Cognit & Computat Grp CO3, Ctr Res Cognit & Neurosci, ULB Neurosci Inst, Brussels, Belgium; [Bulnes, L. C.; Vandekerckhove, M.] Vrije Univ Brussel, Biol Psychol Res Unit BIPS, Brussels, Belgium; [Marien, P.] Vrije Univ Brussel, Clin & Expt Neurolinguist, Brussels, Belgium; [Marien, P.] ZNA Middelheim Hosp, Dept Neurol & Memory Clin, Antwerp, Belgium; [Bulnes, L. C.] Univ Libre Bruxelles, Consciousness Cognit & Computat Grp CO3, Ctr Res Cognit & Neurosci, ULB Neurosci Inst, Brussels, Belgium; [Bulnes, L. C.] Vrije Univ Brussel, Biol Psychol Res Unit BIPS, Brussels, Belgium",,,,,,,,3,,,,,,,Multidisciplinary Sciences,WOS:000480517100014,
J,"Derksen, Maarten",,,,,,,,Putting Popper to work,,,,,,,,THEORY & PSYCHOLOGY,,,,29,4,,,449,465,,10.1177/0959354319838343,,,Aug-19,2019,"In response to what are seen as fundamental problems in Psychology, a reform movement has emerged that finds inspiration in philosophy of science, the work of Karl Popper in particular. The reformers attempt to put Popper into practice and create a discipline based on the principles of critical rationalism. In this article I describe the concrete sociotechnical practices by which the reformers attempt to realise their ideals, and I argue that they go a long way towards bridging the gap between rules and practice that sociologists of science Mulkay and Gilbert had identified in their study of the role of Popper's philosophy in the work of scientists. Second, I note the considerable resistance that the reformers meet and the disruptive force of their work. I argue that this disruption is productive and raises fundamental questions regarding psychology and its object of study.",,"[Derksen, Maarten] Univ Groningen, Theory & Hist Psychol, Groningen, Netherlands; [Derksen, Maarten] Univ Groningen, Grote Kruisstr 2-1, NL-9712 TS Groningen, Netherlands",,,,,,,,4,,,,,,,"Psychology, Multidisciplinary",WOS:000479091700002,
J,"Korb, Sebastian; Goldman, Robin; Davidson, Richard J.; Niedenthal, Paula M.",,,,,,,,Increased Medial Prefrontal Cortex and Decreased Zygomaticus Activation in Response to Disliked Smiles Suggest Top-Down Inhibition of Facial Mimicry,,,,,,,,FRONTIERS IN PSYCHOLOGY,,,,10,,,,,,1715,10.3389/fpsyg.2019.01715,,,JUL 26 2019,2019,"Spontaneous facial mimicry is modulated by many factors, and often needs to be suppressed to comply with social norms. The neural basis for the inhibition of facial mimicry was investigated in a combined functional magnetic resonance imaging and electromyography study in 39 healthy participants. In an operant conditioning paradigm, face identities were associated with reward or punishment and were later shown expressing dynamic smiles and anger expressions. Face identities previously associated with punishment, compared to reward, were disliked by participants overall, and their smiles generated less mimicry. Consistent with previous research on the inhibition of finger/hand movements, the medial prefrontal cortex (mPFC) was activated when previous conditioning was incongruent with the valence of the expression. On such trials there was also greater functional connectivity of the mPFC with insula and premotor cortex as tested with psychophysiological interaction, suggesting inhibition of areas associated with the production of facial mimicry and the processing of facial feedback. The findings suggest that the mPFC supports the inhibition of facial mimicry, and support the claim of theories of embodied cognition that facial mimicry constitutes a spontaneous low-level motor imitation.",,"[Korb, Sebastian] Univ Vienna, Fac Psychol, Dept Appl Psychol Hlth Dev Enhancement & Interven, Vienna, Austria; [Korb, Sebastian; Davidson, Richard J.; Niedenthal, Paula M.] Univ Wisconsin, Dept Psychol, 1202 W Johnson St, Madison, WI 53706 USA; [Goldman, Robin; Davidson, Richard J.] Univ Wisconsin, Ctr Hlth Minds, Madison, WI USA; [Korb, Sebastian] Univ Vienna, Fac Psychol, Dept Appl Psychol Hlth Dev Enhancement & Interven, Vienna, Austria; [Korb, Sebastian] Univ Wisconsin, Dept Psychol, 1202 W Johnson St, Madison, WI 53706 USA",,,,,,,,6,,,,,,,"Psychology, Multidisciplinary",WOS:000477782000001,
J,"Gawronski, Bertram",,,,,,,,Six Lessons for a Cogent Science of Implicit Bias and Its Criticism,,,,,,,,PERSPECTIVES ON PSYCHOLOGICAL SCIENCE,,,,14,4,,,574,595,,10.1177/1745691619826015,,,Jul-19,2019,"Skepticism about the explanatory value of implicit bias in understanding social discrimination has grown considerably. The current article argues that both the dominant narrative about implicit bias as well as extant criticism are based on a selective focus on particular findings that fails to consider the broader literature on attitudes and implicit measures. To provide a basis to move forward, the current article discusses six lessons for a cogent science of implicit bias: (a) There is no evidence that people are unaware of the mental contents underlying their implicit biases; (b) conceptual correspondence is essential for interpretations of dissociations between implicit and explicit bias; (c) there is no basis to expect strong unconditional relations between implicit bias and behavior; (d) implicit bias is less (not more) stable over time than explicit bias; (e) context matters fundamentally for the outcomes obtained with implicit-bias measures; and (f) implicit measurement scores do not provide process-pure reflections of bias. The six lessons provide guidance for research that aims to provide more compelling evidence for the properties of implicit bias. At the same time, they suggest that extant criticism does not justify the conclusion that implicit bias is irrelevant for the understanding of social discrimination.",,"[Gawronski, Bertram] Univ Texas Austin, Dept Psychol, 108 E Dean Keeton A8000, Austin, TX 78712 USA; [Gawronski, Bertram] Univ Texas Austin, Dept Psychol, 108 E Dean Keeton A8000, Austin, TX 78712 USA",,,,,,,,27,,,,,,,"Psychology, Multidisciplinary",WOS:000474242600006,
J,"Palagi, Elisabetta; Norscia, Ivan; Pressi, Serena; Cordoni, Giada",,,,,,,,Facial Mimicry and Play: A Comparative Study in Chimpanzees and Gorillas,,,,,,,,EMOTION,,,,19,4,,,665,681,,10.1037/emo0000476,,,Jun-19,2019,"Play fighting, a common form of mammalian play, can escalate into aggression if playful motivation is misinterpreted and not shared by players. In primates, playful facial expressions and mimicry can be performed to signal and share playful motivation. Here we compare play facial expressions (play face [PF]: lower teeth exposed; full play face [FPF]: upper and lower teeth exposed) and their mimicry in captive chimpanzees and lowland gorillas, during play fighting. These two species have different social dynamics, with social cohesion being lower-and play possibly riskier-in gorillas than in chimpanzees. Thus, we hypothesized that gorillas would perform redundant PFs more often to avoid misunderstanding (Prediction 1). However, the two species are phylogenetically very close and possess a similar biology. Thus, we hypothesized that both species could perform rapid facial mimicry (RFM: response within 1 s) and delayed facial mimicry (DFM: response occurring between 1 s and 5 s), which may have different roles in play modulation (Prediction 2). Gorillas performed more FPF than chimpanzees and FPFs lasted longer than the less intense PF (Prediction 1 supported). RFM was present in both species, whereas DFM was present only in chimpanzees (Prediction 2 not fully supported). DFM may be performed by chimpanzees to modulate the session at a later stage of the interaction and favor interindividual cohesion. RFM prolonged play sessions and may be performed to communicate playful motivation to the playmate thus demonstrating that animals integrate contextual information into their understanding of others' states and intentions.",,"[Palagi, Elisabetta; Norscia, Ivan; Pressi, Serena; Cordoni, Giada] Univ Pisa, Nat Hist Museum, Via Roma 79, I-56011 Pisa, Italy; [Norscia, Ivan] Univ Torino, Dept Life Sci & Syst Biol, Turin, Italy; [Palagi, Elisabetta] Univ Pisa, Nat Hist Museum, Via Roma 79, I-56011 Pisa, Italy",,,,,,,,7,,,,,,,"Psychology, Experimental",WOS:000468755500011,
